query_num_results_total	query_num_results_page	query_page_number	query	serp_rank	serp_type	serp_url	serp_rating	serp_title	serp_domain	serp_visible_link	serp_snippet	serp_sitelinks	screenshot
0	20	1	ageusia	18	results	https://en.wiktionary.org/wiki/ageusia		ageusia - Wiktionaryen.wiktionary.org › wiki › ageusia	en.wiktionary.org	en.wiktionary.org › wiki › ageusia	NounEdit. ageusia (countable and uncountable, plural ageusias). Absence of the sense of taste. Partial or complete loss of the sense of taste.		/tmp/screenshots/2020-09-17/google_ageusia-p1.png
0	20	1	ageusia	19	results	https://www.spandidos-publications.com/10.3892/etm.2020.8808		Anosmia and ageusia associated with coronavirus infection ...www.spandidos-publications.com › etm.2020.8808	www.spandidos-publications.com	www.spandidos-publications.com › etm.2020.8808	May 28, 2020 - Anosmia (loss of smell), and ageusia (loss of taste) become more frequently cited as independent symptoms or in association with the most ...		/tmp/screenshots/2020-09-17/google_ageusia-p1.png
0	20	1	ageusia	20	results	https://www.thefreedictionary.com/ageusia		Ageusia - definition of ageusia by The Free Dictionarywww.thefreedictionary.com › ageusia	www.thefreedictionary.com	www.thefreedictionary.com › ageusia	ageusia. the partial or complete loss of the sense of taste. Also ageustia. See also: Disease and Illness. -Ologies ...		/tmp/screenshots/2020-09-17/google_ageusia-p1.png
0	20	1	ageusia	21	results	https://psychology.wikia.org/wiki/Ageusia		Ageusia | Psychology Wiki | Fandompsychology.wikia.org › wiki › Ageusia	psychology.wikia.org	psychology.wikia.org › wiki › Ageusia	Neurological Damage. Tissue damage to the nerves that support the tongue can cause ageusia, especially damage to the lingual nerve and the glossopharyngeal ...		/tmp/screenshots/2020-09-17/google_ageusia-p1.png
0	20	1	ageusia	22	results	https://www.clinicalmicrobiologyandinfection.com/article/S1198-743X(20)30303-7/pdf		New-onset anosmia and ageusia in adult patients diagnosed ...www.clinicalmicrobiologyandinfection.com › article › pdf	www.clinicalmicrobiologyandinfection.com	www.clinicalmicrobiologyandinfection.com › article › pdf	Jun 2, 2020 - Objectives: We investigated the prevalence of anosmia and ageusia in adult patients with a laboratory- confirmed diagnosis of infection with ...		/tmp/screenshots/2020-09-17/google_ageusia-p1.png
0	20	1	ageusia	23	results	https://ecancer.org/en/journal/editorial/98-anosmia-and-ageusia-are-emerging-as-symptoms-in-patients-with-covid-19-what-does-the-current-evidence-say		Anosmia and ageusia are emerging as symptoms in patients ...ecancer.org › journal › editorial › 98-anosmia-and-ageusia-are-emerg...	ecancer.org	ecancer.org › journal › editorial › 98-anosmia-and-ageusia-are-emerg...	Apr 3, 2020 - Anosmia and ageusia are emerging as symptoms in patients with COVID-19: What does the current evidence say? Beth Russell*1, Charlotte ...		/tmp/screenshots/2020-09-17/google_ageusia-p1.png
0	20	1	ageusia	24	results	https://www.sharecare.com/health/tooth-and-mouth-disorders/what-causes-ageusia		What causes ageusia? | Tooth & Mouth Disorders - Sharecarewww.sharecare.com › ... › Oral Health › Tooth & Mouth Disorders	www.sharecare.com	www.sharecare.com › ... › Oral Health › Tooth & Mouth Disorders	Ageusia is another term for taste impairment or loss. It can be caused by many factors. Some of the most common include smoking and it can also be a t.		/tmp/screenshots/2020-09-17/google_ageusia-p1.png
0	20	1	ageusia	25	results	https://github.com/obophenotype/mammalian-phenotype-ontology/issues/3211		ageusia/hypogeusia/dysgeusia terms · Issue #3211 ... - GitHubgithub.com › obophenotype › mammalian-phenotype-ontology › issues	github.com	github.com › obophenotype › mammalian-phenotype-ontology › issues	Jun 3, 2020 - Consider adding the following new terms: ageusia (a child abnormal taste sensitivity MP:0001986) DEF: complete absence or loss of the sense ...		/tmp/screenshots/2020-09-17/google_ageusia-p1.png
0	20	1	ageusia	26	results	https://www.youtube.com/watch?v=PGWmLiVBqrY		Ageusia - YouTubewww.youtube.com › watch	www.youtube.com	www.youtube.com › watch	Oct 14, 2015 - Ageusia is the loss of taste functions of the tongue, particularly the inability to detect sweetness, sourness, bitterness, saltiness, and umami.		/tmp/screenshots/2020-09-17/google_ageusia-p1.png
0	21	1	cough	1	results	https://www.mayoclinic.org/symptoms/cough/basics/definition/sym-20050846		Cough - Mayo Clinicwww.mayoclinic.org › basics › definition › sym-20050846	www.mayoclinic.org	www.mayoclinic.org › basics › definition › sym-20050846			/tmp/screenshots/2020-09-17/google_cough-p1.png
0	21	1	cough	3	results	https://www.healthline.com/health/managing-idiopathic-pulmonary-fibrosis/should-i-be-worried-about-my-dry-cough		Should I Be Worried About My Dry Cough? - Healthlinewww.healthline.com › health › should-i-be-worried-about...	www.healthline.com	www.healthline.com › health › should-i-be-worried-about...			/tmp/screenshots/2020-09-17/google_cough-p1.png
0	21	1	cough	5	results	https://www.healthline.com/symptom/cough		Why Am I Coughing? Causes, Prevention, and More - Healthlinewww.healthline.com › symptom › cough	www.healthline.com	www.healthline.com › symptom › cough			/tmp/screenshots/2020-09-17/google_cough-p1.png
0	21	1	cough	6	results	https://symptoms.webmd.com/cold-flu-map/treating-your-cough		Treating a Cough From a Cold or the Flu - WebMD Symptom Checkersymptoms.webmd.com › cold-flu-map › treating-your-co...	symptoms.webmd.com	symptoms.webmd.com › cold-flu-map › treating-your-co...			/tmp/screenshots/2020-09-17/google_cough-p1.png
0	21	1	cough	7	results	https://www.dispatchhealth.com/blog/cough-that-wont-go-away/		Cough That Won't Go Away? What it Means & When to Seek ...www.dispatchhealth.com › blog › cough-that-wont-go-aw...	www.dispatchhealth.com	www.dispatchhealth.com › blog › cough-that-wont-go-aw...			/tmp/screenshots/2020-09-17/google_cough-p1.png
0	21	1	cough	9	results	https://www.webmd.com/cold-and-flu/overview		Coughing Causes: Why You Cough & How To Prevent ...www.webmd.com › Cold, Flu, & Cough › Reference	www.webmd.com	www.webmd.com › Cold, Flu, & Cough › Reference	Jan 19, 2020 - WebMD has the basics on common triggers, related symptoms, and treatment options for your cough.		/tmp/screenshots/2020-09-17/google_cough-p1.png
0	21	1	cough	10	results	https://medlineplus.gov/cough.html		Cough | Chronic Cough | Acute Cough | MedlinePlusmedlineplus.gov › Health Topics	medlineplus.gov	medlineplus.gov › Health Topics	Aug 7, 2020 - Coughing helps your body heal or protect itself. There are two types of coughs: acute and chronic. Learn the causes of chronic cough.		/tmp/screenshots/2020-09-17/google_cough-p1.png
0	21	1	cough	11	results	https://www.health.harvard.edu/staying-healthy/that-nagging-cough		That nagging cough - Harvard Healthwww.health.harvard.edu › staying-healthy › that-naggi...	www.health.harvard.edu	www.health.harvard.edu › staying-healthy › that-naggi...	Feb 7, 2019 - A persistent or chronic cough that lasts longer than a few weeks can be worrisome, but for nonsmokers, the most common causes include ...		/tmp/screenshots/2020-09-17/google_cough-p1.png
0	21	1	cough	12	results	https://www.mayoclinic.org/symptoms/cough/basics/causes/sym-20050846		Cough Causes - Mayo Clinicwww.mayoclinic.org › basics › causes › sym-20050846	www.mayoclinic.org	www.mayoclinic.org › basics › causes › sym-20050846	Cough: Symptom — Your body's response when something irritates your throat or airways and possible causes of this symptom.		/tmp/screenshots/2020-09-17/google_cough-p1.png
0	21	1	cough	13	results	https://www.medicinenet.com/chronic_cough/article.htm		Chronic Cough: Treatment, Home Remedies, Symptoms ...www.medicinenet.com › chronic_cough › article	www.medicinenet.com	www.medicinenet.com › chronic_cough › article	Chronic cough in children and adults is a persistent cough. Causes of chronic cough include colds, GERD, bronchitis, drugs, and smoking. Chronic coughs can ...		/tmp/screenshots/2020-09-17/google_cough-p1.png
0	21	1	cough	14	results	https://www.lung.org/lung-health-diseases/wellness/cough/learn-about-cough		Learn About Cough | American Lung Associationwww.lung.org › lung-health-diseases › wellness › learn...	www.lung.org	www.lung.org › lung-health-diseases › wellness › learn...	Jul 29, 2020 - A cough is a spontaneous reflex. When things such as mucus, germs or dust irritate your throat and airways, your body automatically responds ...		/tmp/screenshots/2020-09-17/google_cough-p1.png
0	21	1	cough	15	results	https://kidshealth.org/en/parents/childs-cough.html		Coughing (for Parents) - Nemours KidsHealthkidshealth.org › parents › childs-cough	kidshealth.org	kidshealth.org › parents › childs-cough	"Cough With Wheezing; Nighttime Cough; Daytime Cough; Cough With a Fever; Cough With Vomiting; Persistent Cough. ""Barky"" Cough. Barky coughs are usually ..."		/tmp/screenshots/2020-09-17/google_cough-p1.png
0	21	1	cough	16	results	https://www.medicalnewstoday.com/articles/220349		Coughs: Causes, symptoms, and treatmentswww.medicalnewstoday.com › articles	www.medicalnewstoday.com	www.medicalnewstoday.com › articles	Coughing is the fast expulsion of air from the lungs when the vocal chords are open, which gives a cough its characteristic sound. Find out here about why we ...		/tmp/screenshots/2020-09-17/google_cough-p1.png
0	21	1	cough	17	results	https://www.nhlbi.nih.gov/health-topics/cough		Cough | NHLBI, NIH - National Heart, Lung, and Blood Institutewww.nhlbi.nih.gov › health-topics › cough	www.nhlbi.nih.gov	www.nhlbi.nih.gov › health-topics › cough	Some medical conditions or medicines irritate the nerve endings in your airways and cause coughing. A cough may be acute, subacute, or chronic depending on ...		/tmp/screenshots/2020-09-17/google_cough-p1.png
0	21	1	cough	18	results	https://en.wikipedia.org/wiki/Cough		Cough - Wikipediaen.wikipedia.org › wiki › Cough	en.wikipedia.org	en.wikipedia.org › wiki › Cough	A cough is a sudden expulsion of air through the large breathing passages that can help clear them of fluids, irritants, foreign particles and microbes.		/tmp/screenshots/2020-09-17/google_cough-p1.png
0	21	1	cough	20	results	https://www.nhsinform.scot/illnesses-and-conditions/lungs-and-airways/cough		Cough | NHS informwww.nhsinform.scot › lungs-and-airways › cough	www.nhsinform.scot	www.nhsinform.scot › lungs-and-airways › cough	Aug 1, 2020 - Persistent coughs. A persistent cough may be caused by: a long-term respiratory tract infection, such as chronic bronchitis; asthma – this also ...		/tmp/screenshots/2020-09-17/google_cough-p1.png
0	21	1	cough	21	results	https://www.pennmedicine.org/for-patients-and-visitors/patient-information/conditions-treated-a-to-z/cough		Cough - Symptoms and Causes - Penn Medicinewww.pennmedicine.org › conditions-treated-a-to-z › co...	www.pennmedicine.org	www.pennmedicine.org › conditions-treated-a-to-z › co...	Coughing · Acute coughs usually begin rapidly and are often due to a cold, flu, or sinus infection. They usually go away after 3 weeks. · Subacute coughs last 3 to 8 ...		/tmp/screenshots/2020-09-17/google_cough-p1.png
0	21	1	cough	22	results	https://www.cdc.gov/pertussis/about/signs-symptoms.html		Pertussis | Whooping Cough | Signs and Symptoms | CDCwww.cdc.gov › pertussis › about › signs-symptoms	www.cdc.gov	www.cdc.gov › pertussis › about › signs-symptoms	In most cases, the cough won't last as many days; Coughing fits, whooping, and vomiting after coughing fits occur less often; The percentage of children with ...		/tmp/screenshots/2020-09-17/google_cough-p1.png
0	21	1	cough	23	results	https://www.nhs.uk/conditions/cough/		Cough - NHSwww.nhs.uk › conditions › cough	www.nhs.uk	www.nhs.uk › conditions › cough	Read about some of the main causes or short- and long-term coughs, when to see your GP, and what treatments are available.		/tmp/screenshots/2020-09-17/google_cough-p1.png
0	21	1	cough	24	results	https://www.youtube.com/watch?v=1Y-C9RMyaQQ		Why Do We Cough? - YouTubewww.youtube.com › watch	www.youtube.com	www.youtube.com › watch	Jan 6, 2020 - A cough is an important reflex that helps protect your airways and lungs. Coughing can propel air and particles out of your lungs and throat at ...		/tmp/screenshots/2020-09-17/google_cough-p1.png
0	21	1	cough	25	results	https://familydoctor.org/symptom/cough/		Cough - familydoctor.orgfamilydoctor.org › symptom › cough	familydoctor.org	familydoctor.org › symptom › cough	Oct 5, 2016 - A cough is an annoying symptom that can have many causes. Follow this chart to help identify your problem…		/tmp/screenshots/2020-09-17/google_cough-p1.png
0	23	1	throat pain	1	results	https://www.mayoclinic.org/diseases-conditions/sore-throat/symptoms-causes/syc-20351635		Sore throat - Symptoms and causes - Mayo Clinicwww.mayoclinic.org › symptoms-causes › syc-20351635	www.mayoclinic.org	www.mayoclinic.org › symptoms-causes › syc-20351635	Jul 21, 2020 - Overview. A sore throat is pain, scratchiness or irritation of the throat that often worsens when you swallow. The most common cause of a sore ...		/tmp/screenshots/2020-09-17/google_throat pain-p1.png
0	23	1	throat pain	2	results	https://www.healthline.com/health/sore-throat		Sore Throat: Treatment, Causes, Diagnosis, Symptoms & Morewww.healthline.com › health › sore-throat	www.healthline.com	www.healthline.com › health › sore-throat	A sore throat is a painful, dry, or scratchy feeling in the throat. Pain in the throat is one of the most common symptoms. It accounts for more than 13 million visits to ...		/tmp/screenshots/2020-09-17/google_throat pain-p1.png
0	23	1	throat pain	3	results	https://www.healthline.com/health/sore-throat-coronavirus		Sore Throat Coronavirus: Is a Sore Throat a Symptom of ...www.healthline.com › health › sore-throat-coronavirus	www.healthline.com	www.healthline.com › health › sore-throat-coronavirus	Jul 7, 2020 - But common flu symptoms — like chills, headache, and body aches and pains — are less common with COVID-19. What should you do if you ...		/tmp/screenshots/2020-09-17/google_throat pain-p1.png
0	23	1	throat pain	4	results	https://www.cdc.gov/groupastrep/diseases-public/strep-throat.html		Worried your sore throat may be strep? | CDCwww.cdc.gov › groupastrep › diseases-public › strep-th...	www.cdc.gov	www.cdc.gov › groupastrep › diseases-public › strep-th...	Pain and Fever without a Cough Are Common Signs and Symptoms. In general, strep throat is a mild infection, but it can be very painful. The most common ...		/tmp/screenshots/2020-09-17/google_throat pain-p1.png
0	23	1	throat pain	5	results	https://www.mskcc.org/cancer-care/types/throat/throat-cancer-symptoms		Throat Cancer Signs & Symptoms | Memorial Sloan Kettering ...www.mskcc.org › ... › Cancer Types › Throat Cancer	www.mskcc.org	www.mskcc.org › ... › Cancer Types › Throat Cancer	Sore throat: Pain or discomfort in your throat that doesn't go away is one of the most common symptoms of throat cancer. Voice changes: Cancer in your throat can ...		/tmp/screenshots/2020-09-17/google_throat pain-p1.png
0	23	1	throat pain	6	results	https://www.health.harvard.edu/diseases-and-conditions/covid-19-basics#:~:text=Some%20people%20infected%20with%20the,and%20loss%20of%20smell.		COVID-19 basicswww.health.harvard.edu › diseases-and-conditions › covi...	www.health.harvard.edu	www.health.harvard.edu › diseases-and-conditions › covi...			/tmp/screenshots/2020-09-17/google_throat pain-p1.png
0	23	1	throat pain	8	results	https://health.mountsinai.org/blog/i-think-i-have-covid-19-how-can-i-take-care-of-myself-at-home/#:~:text=If%20you%20find%20your%20throat,best%20on%20your%20throat.		Riding Out COVID-19 at Home | Mount Sinai Todayhealth.mountsinai.org › blog › i-think-i-have-covid-19-h...	health.mountsinai.org	health.mountsinai.org › blog › i-think-i-have-covid-19-h...			/tmp/screenshots/2020-09-17/google_throat pain-p1.png
0	23	1	throat pain	9	results	https://www.webmd.com/lung/covid-19-symptoms#:~:text=Early%20studies%20have%20found%20that,%E2%80%9Cproductive%E2%80%9D%20cough.		Symptoms of Coronavirus: Early Signs, Serious Symptoms and Morewww.webmd.com › lung › covid-19-symptoms	www.webmd.com	www.webmd.com › lung › covid-19-symptoms			/tmp/screenshots/2020-09-17/google_throat pain-p1.png
0	23	1	throat pain	10	results	https://www.medscape.com/answers/2500114-197430/how-long-do-coronavirus-disease-2019-covid-19-symptoms-take-to-develop#:~:text=Symptoms%20may%20develop%202%20days,11.5%20days%20of%20infection.		How long do coronavirus disease 2019 (COVID-19) symptoms take to develop?www.medscape.com › answers › how-long-do-coronaviru...	www.medscape.com	www.medscape.com › answers › how-long-do-coronaviru...			/tmp/screenshots/2020-09-17/google_throat pain-p1.png
0	23	1	throat pain	11	results	https://www.nhs.uk/conditions/sore-throat/		Sore throat - NHSwww.nhs.uk › conditions › sore-throat	www.nhs.uk	www.nhs.uk › conditions › sore-throat	Find out what can cause a sore throat, how you can soothe it and when to get medical advice. ... To help relieve the pain and discomfort of a sore throat, you can:.		/tmp/screenshots/2020-09-17/google_throat pain-p1.png
0	23	1	throat pain	12	results	https://www.uofmhealth.org/health-library/sorth		Sore Throat and Other Throat Problems | Michigan Medicinewww.uofmhealth.org › health-library › sorth	www.uofmhealth.org	www.uofmhealth.org › health-library › sorth	Sore throats can be painful and annoying. Fortunately, most sore throats are caused by a minor illness and go away without medical treatment. Several ...		/tmp/screenshots/2020-09-17/google_throat pain-p1.png
0	23	1	throat pain	13	results	https://www.webmd.com/cold-and-flu/sore-throat-cold-strep-throat-tonsillitis		Sore Throat? Find Out if It's a Cold, Strep Throat, or Tonsillitiswww.webmd.com › Cold, Flu, & Cough › Reference	www.webmd.com	www.webmd.com › Cold, Flu, & Cough › Reference	Feb 5, 2020 - Pain relievers, such as acetaminophen and ibuprofen and naproxen, to relieve the aches and pains of a cold and sore throat. (Aspirin should not ...		/tmp/screenshots/2020-09-17/google_throat pain-p1.png
0	23	1	throat pain	14	results	https://www.medstarhealth.org/medstar-blog/is-sore-throat-a-common-covid-19-symptom/		Is sore throat a common COVID-19 ... - MedStar Health Blogwww.medstarhealth.org › medstar-blog › is-sore-throat-...	www.medstarhealth.org	www.medstarhealth.org › medstar-blog › is-sore-throat-...	Aug 5, 2020 - While sore throat can be a symptom of COVID-19, it's not common. ... COVID-19, there are a few things you can do at home to ease your pain.		/tmp/screenshots/2020-09-17/google_throat pain-p1.png
0	23	1	throat pain	15	results	https://www.mountsinai.org/health-library/diseases-conditions/pharyngitis-sore-throat		Pharyngitis - sore throat Information | Mount Sinai - New Yorkwww.mountsinai.org › diseases-conditions › pharyngiti...	www.mountsinai.org	www.mountsinai.org › diseases-conditions › pharyngiti...	Pharyngitis, or sore throat, is discomfort, pain, or scratchiness in the throat. It often makes it painful to swallow. Throat anatomy. Structures of the throat include the ...		/tmp/screenshots/2020-09-17/google_throat pain-p1.png
0	23	1	throat pain	16	results	https://kidshealth.org/en/parents/sore-throat-sheet.html		First Aid: Sore Throat (for Parents) - Nemours KidsHealthkidshealth.org › parents › sore-throat-sheet	kidshealth.org	kidshealth.org › parents › sore-throat-sheet	Signs and Symptoms · painful throat · fever · swollen glands in the neck · bad breath · scratchiness in the throat · redness in the back of the mouth ...		/tmp/screenshots/2020-09-17/google_throat pain-p1.png
0	23	1	throat pain	17	results	https://www.indigourgentcare.com/what-we-treat/sore-throat		Severe and Mild Sore Throat Causes and Treatment ...www.indigourgentcare.com › what-we-treat › sore-throat	www.indigourgentcare.com	www.indigourgentcare.com › what-we-treat › sore-throat	Runny nose and sneezing; Stomach pains. Treatment. Some sore throats can be treated at home, depending on the cause. Home remedies for sore throat pain ...		/tmp/screenshots/2020-09-17/google_throat pain-p1.png
0	23	1	throat pain	18	results	https://osteopathic.org/what-is-osteopathic-medicine/sore-throat/		Sore Throat: When to See a Doctor | American Osteopathic ...osteopathic.org › what-is-osteopathic-medicine › sore-t...	osteopathic.org	osteopathic.org › what-is-osteopathic-medicine › sore-t...	Not only are sore throats painful, but they also are one of the top reasons for doctor visits and sick days. It starts as a persistent tickle in the back of your throat ...		/tmp/screenshots/2020-09-17/google_throat pain-p1.png
0	23	1	throat pain	19	results	https://myhealth.alberta.ca/health/AfterCareInformation/pages/conditions.aspx?hwid=uh2986&		Sore Throat: Care Instructions - MyHealth Albertamyhealth.alberta.ca › health › pages › conditions	myhealth.alberta.ca	myhealth.alberta.ca › health › pages › conditions	Take an over-the-counter pain medicine, such as acetaminophen (Tylenol), ibuprofen (Advil, Motrin), or naproxen (Aleve). Read and follow all instructions on the ...		/tmp/screenshots/2020-09-17/google_throat pain-p1.png
0	23	1	throat pain	20	results	https://www.nhsinform.scot/illnesses-and-conditions/ears-nose-and-throat/sore-throat		Sore throat causes & treatments - Illnesses & conditions | NHS ...www.nhsinform.scot › ears-nose-and-throat › sore-throat	www.nhsinform.scot	www.nhsinform.scot › ears-nose-and-throat › sore-throat	May 20, 2020 - quinsy (a painful collection of pus at the back of the throat) – the pain may be severe and you may also have difficulty opening your mouth or ...		/tmp/screenshots/2020-09-17/google_throat pain-p1.png
0	23	1	throat pain	21	results	https://www.pennmedicine.org/updates/blogs/health-and-wellness/2018/february/sore-throat		6 At-Home Remedies to Ease Your Sore Throat - Penn Medicinewww.pennmedicine.org › health-and-wellness › february	www.pennmedicine.org	www.pennmedicine.org › health-and-wellness › february	Jan 8, 2018 - They are typically caused by infections including the common cold, flu and strep throat and while they tend to be quite painful, they often go ...		/tmp/screenshots/2020-09-17/google_throat pain-p1.png
0	23	1	throat pain	22	results	https://medlineplus.gov/sorethroat.html		Sore Throat | Pharyngitis | Sore Throat Causes | MedlinePlusmedlineplus.gov › Health Topics	medlineplus.gov	medlineplus.gov › Health Topics	May 11, 2020 - Strep throat · Tonsillitis. Treatment depends on the cause. Sucking on lozenges, drinking lots of liquids, and gargling may ease the pain. Over-the- ...		/tmp/screenshots/2020-09-17/google_throat pain-p1.png
0	23	1	throat pain	23	results	https://familydoctor.org/condition/sore-throat/		Sore Throat - How to Get Rid of A Sore Throat | familydoctor.orgfamilydoctor.org › condition › sore-throat	familydoctor.org	familydoctor.org › condition › sore-throat	Jan 18, 2019 - A sore throat means that your throat hurts. It feels irritated or scratchy. You may feel mild discomfort or a burning pain. A sore throat may feel ...		/tmp/screenshots/2020-09-17/google_throat pain-p1.png
0	23	1	throat pain	24	results	https://newsinhealth.nih.gov/2013/03/soothing-sore-throat		Soothing a Sore Throat | NIH News in Healthnewsinhealth.nih.gov › 2013/03 › soothing-sore-throat	newsinhealth.nih.gov	newsinhealth.nih.gov › 2013/03 › soothing-sore-throat	Throat pain might also be soothed by throat sprays and over-the-counter pain relievers such as acetaminophen, ibuprofen or aspirin, but don't give aspirin to ...		/tmp/screenshots/2020-09-17/google_throat pain-p1.png
0	24	1	shortness of breath	1	results	https://www.mayoclinic.org/symptoms/shortness-of-breath/basics/causes/sym-20050890		Shortness of breath Causes - Mayo Clinicwww.mayoclinic.org › basics › causes › sym-20050890	www.mayoclinic.org	www.mayoclinic.org › basics › causes › sym-20050890	Most cases of shortness of breath are due to heart or lung conditions. Your heart and lungs are involved in transporting oxygen to your tissues and removing ...		/tmp/screenshots/2020-09-17/google_shortness of breath-p1.png
0	24	1	shortness of breath	2	results	https://www.mayoclinic.org/symptoms/shortness-of-breath/basics/definition/sym-20050890		Shortness of breath - Mayo Clinicwww.mayoclinic.org › definition › sym-20050890	www.mayoclinic.org	www.mayoclinic.org › definition › sym-20050890	Few sensations are as frightening as not being able to get enough air. Shortness of breath — known medically as dyspnea — is often described as an intense ...		/tmp/screenshots/2020-09-17/google_shortness of breath-p1.png
0	24	1	shortness of breath	3	results	https://www.healthline.com/health/coronavirus-shortness-of-breath		Coronavirus and Shortness of Breath: What Does It Feel Like?www.healthline.com › health › coronavirus-shortness-o...	www.healthline.com	www.healthline.com › health › coronavirus-shortness-o...	Jun 5, 2020 - Shortness of breath can make it hard to breathe deeply. You may feel winded, or as if you can't get enough air into your lungs. Known clinically ...		/tmp/screenshots/2020-09-17/google_shortness of breath-p1.png
