query_num_results_total	query_num_results_page	query_page_number	query	serp_rank	serp_type	serp_url	serp_rating	serp_title	serp_domain	serp_visible_link	serp_snippet	serp_sitelinks	screenshot
0	23	1	loss smell covid	2	results	https://hms.harvard.edu/news/how-covid-19-causes-loss-smell		How COVID-19 Causes Loss of Smell | Harvard Medical Schoolhms.harvard.edu › news › how-covid-19-causes-loss-s...	hms.harvard.edu	hms.harvard.edu › news › how-covid-19-causes-loss-s...	Jul 24, 2020 - Smell loss clue Together, these data suggest that COVID-19-related anosmia may arise from a temporary loss of function of supporting cells in the olfactory epithelium, which indirectly causes changes to olfactory sensory neurons, the authors said.		/tmp/screenshots/2020-09-17/google_loss smell covid-p1.png
0	23	1	loss smell covid	3	results	https://www.statnews.com/2020/08/14/covid-19-related-smell-loss-reveals-how-the-mind-works/		What Covid-19-related smell loss reveals about how the mind ...www.statnews.com › 2020/08/14 › covid-19-related-sm...	www.statnews.com	www.statnews.com › 2020/08/14 › covid-19-related-sm...	Aug 14, 2020 - Anosmia, the technical term for the once relatively unfamiliar loss of one's ability to smell, is now all too common. It has become a critical ...		/tmp/screenshots/2020-09-17/google_loss smell covid-p1.png
0	23	1	loss smell covid	4	results	https://www.webmd.com/lung/news/20200604/covid19-loss-of-smell-taste-might-be-long-term		COVID-19: Loss of Smell, Taste Might Be Long-Term - WebMDwww.webmd.com › ... › Coronavirus › News	www.webmd.com	www.webmd.com › ... › Coronavirus › News	Jun 4, 2020 - First, there were anecdotal reports of COVID-19 patients who had lost their ability to smell or taste, said Dr. Nicholas Rowan, an assistant ...		/tmp/screenshots/2020-09-17/google_loss smell covid-p1.png
0	23	1	loss smell covid	5	results	https://www.uab.edu/news/health/item/11489-one-teen-s-loss-of-smell-from-covid-19-serves-as-a-reminder-about-pervasiveness-of-virus		One teen's loss of smell from COVID-19 serves as a reminder ...www.uab.edu › news › health › item › 11489-one-teen...	www.uab.edu	www.uab.edu › news › health › item › 11489-one-teen...	Aug 12, 2020 - Kenny Mayfield, 16, lost his sense of taste and smell as a side effect of COVID-19. Nearly seven months later, he still is without the senses.		/tmp/screenshots/2020-09-17/google_loss smell covid-p1.png
0	23	1	loss smell covid	6	results	https://www.ncbi.nlm.nih.gov/pmc/articles/PMC7265845/#:~:text=Anosmia%20is%20a%20prominent%20sign,may%20also%20be%20presented.		COVID-19 and anosmia: A review based on up-to-date knowledgewww.ncbi.nlm.nih.gov › pmc › articles › PMC7265845	www.ncbi.nlm.nih.gov	www.ncbi.nlm.nih.gov › pmc › articles › PMC7265845			/tmp/screenshots/2020-09-17/google_loss smell covid-p1.png
0	23	1	loss smell covid	8	results	http://www.memorialhermann.org/everydaywell/health-wellness/senses/#:~:text=When%20the%20virus%20passes%2C,%E2%80%94but%20not%20always.		Sudden Loss of Smell or Taste Could Be a Sign of COVID-19www.memorialhermann.org › health-wellness › senses	www.memorialhermann.org	www.memorialhermann.org › health-wellness › senses			/tmp/screenshots/2020-09-17/google_loss smell covid-p1.png
0	23	1	loss smell covid	9	results	https://health.mountsinai.org/blog/i-think-i-have-covid-19-how-can-i-take-care-of-myself-at-home/#:~:text=This%20is%20one%20of%20the,Patrick%20Colley%2C%20MD.		Riding Out COVID-19 at Home | Mount Sinai Todayhealth.mountsinai.org › blog › i-think-i-have-covid-19-h...	health.mountsinai.org	health.mountsinai.org › blog › i-think-i-have-covid-19-h...			/tmp/screenshots/2020-09-17/google_loss smell covid-p1.png
0	23	1	loss smell covid	10	results	https://www.mayoclinic.org/diseases-conditions/coronavirus/expert-answers/coronavirus-unusual-symptoms/faq-20487367#:~:text=%2D%20Gastrointestinal%20symptoms.%20COVID,%2C%20vomiting%20and%20diarrhea.&text=%2D%20Loss%20of%20smell%20or%20taste.&text=%2D%20Skin%20changes.&text=%2D%20Confusion.&text=%2D%20Eye%20problems.		Unusual coronavirus (COVID-19) symptoms: What are they?www.mayoclinic.org › expert-answers › faq-20487367	www.mayoclinic.org	www.mayoclinic.org › expert-answers › faq-20487367			/tmp/screenshots/2020-09-17/google_loss smell covid-p1.png
0	23	1	loss smell covid	11	results	https://www.vumc.org/coronavirus/latest-news/five-things-know-about-smell-and-taste-loss-covid-19		Five things to know about smell and taste loss in COVID-19 ...www.vumc.org › coronavirus › latest-news › five-thing...	www.vumc.org	www.vumc.org › coronavirus › latest-news › five-thing...	May 21, 2020 - In COVID-19, we believe smell loss is so prevalent because the receptors for COVID-19 that are expressed in human tissue are most commonly ...		/tmp/screenshots/2020-09-17/google_loss smell covid-p1.png
0	23	1	loss smell covid	12	results	https://www.sciencealert.com/covid-s-impact-on-our-sense-of-smell-is-nothing-like-that-of-a-common-cold		Loss of Smell in COVID-19 Has an Unusual Cause, Study ...www.sciencealert.com › covid-s-impact-on-our-sense-o...	www.sciencealert.com	www.sciencealert.com › covid-s-impact-on-our-sense-o...	Aug 20, 2020 - Losing your senses of taste and smell is a common symptom of COVID-19 – patients have reported being unable to tell that they're wearing ...		/tmp/screenshots/2020-09-17/google_loss smell covid-p1.png
0	23	1	loss smell covid	13	results	https://www.sciencealert.com/scientists-worked-out-how-covid-19-disrupts-some-people-s-smell		COVID-19 Can Cause Loss of Smell, And Scientists Finally ...www.sciencealert.com › scientists-worked-out-how-cov...	www.sciencealert.com	www.sciencealert.com › scientists-worked-out-how-cov...	Jun 22, 2020 - COVID-19 Can Cause Loss of Smell, And Scientists Finally Discovered Why. SIMON GANE & JANE PARKER, THE CONVERSATION. 22 JUNE ...		/tmp/screenshots/2020-09-17/google_loss smell covid-p1.png
0	23	1	loss smell covid	14	results	https://www.biospace.com/article/new-research-sheds-light-on-the-temporary-loss-of-smell-stemming-from-covid-19/		New Research Sheds Light on the Temporary Loss of Smell ...www.biospace.com › article › new-research-sheds-light...	www.biospace.com	www.biospace.com › article › new-research-sheds-light...	Aug 4, 2020 - A loss of the sense of smell has been deemed an underlying symptom of COVID-19 in some patients. However, researchers have found that ...		/tmp/screenshots/2020-09-17/google_loss smell covid-p1.png
0	23	1	loss smell covid	15	results	https://www.pennmedicine.org/updates/blogs/health-and-wellness/2020/june/covid-and-smell		How COVID-19 Can Impact Your Sense of Smell – Penn ...www.pennmedicine.org › health-and-wellness › june	www.pennmedicine.org	www.pennmedicine.org › health-and-wellness › june	Jun 21, 2020 - The most common cause of smell loss in the general population is viruses, like the novel coronavirus that causes COVID-19. Upper respiratory ...		/tmp/screenshots/2020-09-17/google_loss smell covid-p1.png
0	23	1	loss smell covid	16	results	https://www.nationalgeographic.com/science/2020/08/thousands-covid-19-patients-lost-sense-smell-will-get-back-cvd/		Many COVID-19 patients lost their sense of smell. Will they get ...www.nationalgeographic.com › science › 2020/08 › th...	www.nationalgeographic.com	www.nationalgeographic.com › science › 2020/08 › th...	Aug 5, 2020 - For most COVID-19 patients who suffer anosmia, the sense returns within a few weeks, and doctors don't yet know if the virus causes long-term ...		/tmp/screenshots/2020-09-17/google_loss smell covid-p1.png
0	23	1	loss smell covid	17	results	https://www.scientificamerican.com/article/why-covid-19-makes-people-lose-their-sense-of-smell1/		Why COVID-19 Makes People Lose Their Sense of Smell ...www.scientificamerican.com › article › why-covid-19-...	www.scientificamerican.com	www.scientificamerican.com › article › why-covid-19-...	Jun 13, 2020 - This was a lucky diagnosis aided by timing and geography; smell and taste symptoms associated specifically with COVID-19 seem to appear as ...		/tmp/screenshots/2020-09-17/google_loss smell covid-p1.png
0	23	1	loss smell covid	18	results	https://www.mayoclinicproceedings.org/article/S0025-6196(20)30546-2/pdf		Smell and Taste Dysfunction in Patients With COVID-19: A ...www.mayoclinicproceedings.org › article › pdf	www.mayoclinicproceedings.org	www.mayoclinicproceedings.org › article › pdf	diagnosed loss of sense of smell has been reported.5 Similarly, an outbreak of olfactory dysfunctions in Iran was observed.6 Further- more, Walker et al7 have ...		/tmp/screenshots/2020-09-17/google_loss smell covid-p1.png
0	23	1	loss smell covid	19	results	https://www.beckershospitalreview.com/public-health/covid-19-patients-may-not-recover-sense-of-taste-smell-after-other-symptoms-end.html		COVID-19 patients may not recover sense of taste, smell after ...www.beckershospitalreview.com › public-health › covi...	www.beckershospitalreview.com	www.beckershospitalreview.com › public-health › covi...	Jun 1, 2020 - The CDC added a new loss of taste or smell to its list of COVID-19 symptoms at the end of April, and now early data from recovered patients is ...		/tmp/screenshots/2020-09-17/google_loss smell covid-p1.png
0	23	1	loss smell covid	20	results	https://www.bbc.com/news/health-53810610		Coronavirus smell loss 'different from cold and flu' - BBC Newswww.bbc.com › news › health-53810610	www.bbc.com	www.bbc.com › news › health-53810610	Aug 19, 2020 - When Covid-19 patients have smell loss it tends to be sudden and severe. And they usually don't have a blocked, stuffy or runny nose - most ...		/tmp/screenshots/2020-09-17/google_loss smell covid-p1.png
0	23	1	loss smell covid	21	results	https://www.contagionlive.com/news/not-all-covid-19-patients-who-report-loss-of-smell-have-anosmia		Not All COVID-19 Patients Who Report Loss of Smell Have ...www.contagionlive.com › news › not-all-covid-19-pati...	www.contagionlive.com	www.contagionlive.com › news › not-all-covid-19-pati...	Jun 4, 2020 - Not all coronavirus 2019 (COVID-19) patients who report loss of smell as a symptom of the virus have abnormal objective olfactory testing ...		/tmp/screenshots/2020-09-17/google_loss smell covid-p1.png
0	23	1	loss smell covid	22	results	https://www.contagionlive.com/news/how-some-covid19-patients-lose-their-sense-of-smell-		How Some COVID-19 Patients Lose Their Sense of Smellwww.contagionlive.com › news › how-some-covid19-p...	www.contagionlive.com	www.contagionlive.com › news › how-some-covid19-p...	Jul 27, 2020 - The temporary loss of smell, or anosmia, is the main neurological symptom and one of the earliest and most commonly reported indicators of ...		/tmp/screenshots/2020-09-17/google_loss smell covid-p1.png
0	23	1	loss smell covid	23	results	https://www.minnpost.com/second-opinion/2020/08/loss-of-smell-and-taste-in-patients-with-covid-19-is-much-more-profound-than-in-patients-with-the-common-cold-study-finds/		Loss of smell and taste in patients with COVID-19 is 'much ...www.minnpost.com › second-opinion › 2020/08 › loss...	www.minnpost.com	www.minnpost.com › second-opinion › 2020/08 › loss...	Aug 19, 2020 - When people have COVID-19, the loss of smell tends to be sudden and severe, the study found. And, unlike with the cold or flu, the symptom ...		/tmp/screenshots/2020-09-17/google_loss smell covid-p1.png
0	23	1	loss smell covid	24	results	https://www.medpagetoday.com/infectiousdisease/covid19/87405		Smell and Taste Issues Unlikely to Linger After COVID-19 ...www.medpagetoday.com › infectiousdisease › covid19	www.medpagetoday.com	www.medpagetoday.com › infectiousdisease › covid19	Jul 2, 2020 - Temporary loss of smell and taste was tied to COVID-19 infection in mildly symptomatic patients, but did not appear to persist a month after ...		/tmp/screenshots/2020-09-17/google_loss smell covid-p1.png
0	23	1	loss smell covid	25	results	https://www.sciencefocus.com/news/scientists-think-theyve-identified-how-covid-19-causes-patients-to-lose-their-sense-of-smell/		Science reveals why COVID-19 patients lose their sense of ...www.sciencefocus.com › Science news	www.sciencefocus.com	www.sciencefocus.com › Science news	Aug 22, 2020 - New research suggests that the COVID-19 infection begins in the cells of the nose responsible for smell, which is why for some, anosmia is ...		/tmp/screenshots/2020-09-17/google_loss smell covid-p1.png
0	24	1	soreness covid	1	results	https://www.health.com/condition/infectious-diseases/coronavirus/is-muscle-pain-a-symptom-of-coronavirus		Is Muscle Pain a Symptom of Coronavirus? Doctors Explain ...www.health.com › Infectious Diseases › Coronavirus	www.health.com	www.health.com › Infectious Diseases › Coronavirus	Apr 30, 2020 - Now, in addition to the standard dry cough, shortness of breath, and fever, the CDC also lists chills, repeated shaking with chills, headache, sore ...		/tmp/screenshots/2020-09-17/google_soreness covid-p1.png
0	24	1	soreness covid	2	results	https://www1.nyc.gov/site/doh/covid/covid-19-symptoms-chronic-health-risks.page#:~:text=People%20with%20the%20following%20symptoms,get%20them%20for%20you.		COVID-19: Symptoms and What to Do When Sickwww1.nyc.gov › covid-19-symptoms-chronic-health-risks	www1.nyc.gov	www1.nyc.gov › covid-19-symptoms-chronic-health-risks			/tmp/screenshots/2020-09-17/google_soreness covid-p1.png
0	24	1	soreness covid	4	results	https://www.who.int/maldives/news/detail/31-01-2020-updates-on-novel-corona-virus-(COVID-19)#:~:text=The%20virus%20can%20cause%20a,and%20deaths%20can%20occur.		Updates on Novel Corona Virus (COVID-19)www.who.int › maldives › news › detail › 31-01-2020-up...	www.who.int	www.who.int › maldives › news › detail › 31-01-2020-up...			/tmp/screenshots/2020-09-17/google_soreness covid-p1.png
0	24	1	soreness covid	5	results	https://wwwnc.cdc.gov/eid/article/26/7/20-0445_article#:~:text=General%20muscle%20pain%20and%20fatigue,of%20COVID%2D19.		Rhabdomyolysis as Potential Late Complication Associated with COVID-19wwwnc.cdc.gov › eid › article › 20-0445_article	wwwnc.cdc.gov	wwwnc.cdc.gov › eid › article › 20-0445_article			/tmp/screenshots/2020-09-17/google_soreness covid-p1.png
0	24	1	soreness covid	6	results	https://www.cdc.gov/coronavirus/2019-ncov/faq.html#:~:text=Symptoms%20may%20appear%202%2D,to%20COVID%2D19.		Coronavirus (COVID-19) frequently asked questionswww.cdc.gov › coronavirus › 2019-ncov › faq	www.cdc.gov	www.cdc.gov › coronavirus › 2019-ncov › faq			/tmp/screenshots/2020-09-17/google_soreness covid-p1.png
0	24	1	soreness covid	7	results	https://www.theladders.com/career-advice/3-easy-ways-to-tell-if-youre-sore-from-covid-19		This is what muscle pain from COVID-19 feels likewww.theladders.com › career-advice › 3-easy-ways-to-t...	www.theladders.com	www.theladders.com › career-advice › 3-easy-ways-to-t...	May 3, 2020 - There are three sure-fire ways to distinguish pedestrian aches and pains from those caused by coronavirus.		/tmp/screenshots/2020-09-17/google_soreness covid-p1.png
0	24	1	soreness covid	8	results	https://www.healthline.com/health/sore-throat-coronavirus		Sore Throat Coronavirus: Is a Sore Throat a Symptom of ...www.healthline.com › health › sore-throat-coronavirus	www.healthline.com	www.healthline.com › health › sore-throat-coronavirus	Jul 7, 2020 - A sore throat is a potential symptom of COVID-19. However, it's only one of the symptoms that may develop due to infection with the new ...		/tmp/screenshots/2020-09-17/google_soreness covid-p1.png
0	24	1	soreness covid	9	results	https://www.medstarhealth.org/medstar-blog/is-sore-throat-a-common-covid-19-symptom/		Is sore throat a common COVID-19 ... - MedStar Health Blogwww.medstarhealth.org › medstar-blog › is-sore-throat-...	www.medstarhealth.org	www.medstarhealth.org › medstar-blog › is-sore-throat-...	Aug 5, 2020 - While sore throat can be a symptom of COVID-19, it's not common. Here's what you need to know about COVID-19 and sore throat.		/tmp/screenshots/2020-09-17/google_soreness covid-p1.png
0	24	1	soreness covid	10	results	https://www.webmd.com/lung/news/20200508/doctors-update-warning-signs-of-severe-covid		Doctors update warning signs of severe COVID - WebMDwww.webmd.com › ... › Coronavirus › News	www.webmd.com	www.webmd.com › ... › Coronavirus › News	"May 8, 2020 - ""COVID-19 may begin with various permutations of cough without fever, sore throat, diarrhea, abdominal pain, headache, body aches, back ..."		/tmp/screenshots/2020-09-17/google_soreness covid-p1.png
0	24	1	soreness covid	11	results	https://www.health.harvard.edu/diseases-and-conditions/covid-19-basics		COVID-19 basics - Harvard Healthwww.health.harvard.edu › diseases-and-conditions › co...	www.health.harvard.edu	www.health.harvard.edu › diseases-and-conditions › co...	Aug 21, 2020 - As we continually learn more about coronavirus and COVID-19, it can ... symptoms: trouble breathing, persistent pain or pressure in the chest, ...		/tmp/screenshots/2020-09-17/google_soreness covid-p1.png
0	24	1	soreness covid	12	results	https://www.chifranciscan.org/content/dam/chi-franciscan/CHI_Coronavirus_Flyer_v3.pdf		Is it Flu or COVID-19 Coronavirus Disease? - CHI Franciscanwww.chifranciscan.org › content › dam › CHI_Corona...	www.chifranciscan.org	www.chifranciscan.org › content › dam › CHI_Corona...	Feeling very tired (fatigue). • Sore throat. • Runny or stuffy nose. • Fever. • Cough. • Difficulty breathing. • Shortness of breath. Coronavirus (COVID-19) is a new.		/tmp/screenshots/2020-09-17/google_soreness covid-p1.png
0	24	1	soreness covid	13	results	https://wwwnc.cdc.gov/eid/article/26/7/20-0445_article		Rhabdomyolysis as Potential Late Complication Associated ...wwwnc.cdc.gov › eid › article › 20-0445_article	wwwnc.cdc.gov	wwwnc.cdc.gov › eid › article › 20-0445_article	Mar 20, 2020 - General muscle pain and fatigue are common symptoms of COVID-19, but clinicians should consider the diagnosis of rhabdomyolysis when ...		/tmp/screenshots/2020-09-17/google_soreness covid-p1.png
0	24	1	soreness covid	14	results	https://www.nytimes.com/2020/08/05/well/live/coronavirus-covid-symptoms.html		The Many Symptoms of Covid-19 - The New York Timeswww.nytimes.com › Well › Live	www.nytimes.com	www.nytimes.com › Well › Live	Aug 6, 2020 - Although it's rare, Covid-19 can cause painful inflammation in the joints or lead to rhabdomyolysis, a serious and potentially life-threatening ...		/tmp/screenshots/2020-09-17/google_soreness covid-p1.png
0	24	1	soreness covid	15	results	https://www.pennmedicine.org/updates/blogs/musculoskeletal-and-rheumatology/2020/june/joint-tips-during-covid		COVID-19: What Joint Pain Patients Should Know – Penn ...www.pennmedicine.org › june › joint-tips-during-covid	www.pennmedicine.org	www.pennmedicine.org › june › joint-tips-during-covid	Jul 8, 2020 - Penn Medicine orthopedic surgeon, Christopher S. Travers, MD, shares tips on how to protect your joints and manage pain during the ...		/tmp/screenshots/2020-09-17/google_soreness covid-p1.png
0	24	1	soreness covid	16	results	https://www.neomed.edu/news/evaluating-muscle-pain-during-covid-19/		Evaluating Muscle Pain During COVID-19 | NEOMEDwww.neomed.edu › news › evaluating-muscle-pain-dur...	www.neomed.edu	www.neomed.edu › news › evaluating-muscle-pain-dur...	May 7, 2020 - “The pain from working out tends to go away after a few hours, but can persist for days with COVID-19,” Dr. Watkins says. Read the Prevention ...		/tmp/screenshots/2020-09-17/google_soreness covid-p1.png
0	24	1	soreness covid	17	results	https://www.ncbi.nlm.nih.gov/pmc/articles/PMC7249985/		Can COVID-19 cause myalgia with a completely different ...www.ncbi.nlm.nih.gov › pmc › articles › PMC7249985	www.ncbi.nlm.nih.gov	www.ncbi.nlm.nih.gov › pmc › articles › PMC7249985	May 26, 2020 - Back pain in COVID-19 may usually indicate pneumonia. Why is the common myalgia caused by COVID-19 longer and more severe than ...		/tmp/screenshots/2020-09-17/google_soreness covid-p1.png
0	24	1	soreness covid	18	results	https://news.usc.edu/174346/covid-19-symptoms-usc-research-fever-cough/		USC scientists identify the order of COVID-19's symptomsnews.usc.edu › covid-19-symptoms-usc-research-fever-...	news.usc.edu	news.usc.edu › covid-19-symptoms-usc-research-fever-...	Aug 13, 2020 - The initial symptoms of COVID-19 include fever, cough and muscle pain, followed by nausea and/or vomiting and diarrhea. (Photo/iStock).		/tmp/screenshots/2020-09-17/google_soreness covid-p1.png
0	24	1	soreness covid	19	results	https://www.advisory.com/daily-briefing/2020/05/20/covid-symptoms		Hallucinations, 'Covid toes,' and more: The emerging ...www.advisory.com › 2020/05/20 › covid-symptoms	www.advisory.com	www.advisory.com › 2020/05/20 › covid-symptoms	May 20, 2020 - The 3 'standard' symptoms of Covid-19—and why they were an initial ... Covid-19 symptoms: chills, muscle pain, headache, sore throat, loss of ...		/tmp/screenshots/2020-09-17/google_soreness covid-p1.png
0	24	1	soreness covid	20	results	https://www.sciencemag.org/news/2020/07/brain-fog-heart-damage-covid-19-s-lingering-problems-alarm-scientists		From 'brain fog' to heart damage, COVID-19's lingering ...www.sciencemag.org › news › 2020/07 › brain-fog-he...	www.sciencemag.org	www.sciencemag.org › news › 2020/07 › brain-fog-he...	Jul 31, 2020 - Her early symptoms were textbook for COVID-19: a fever and cough, followed by shortness of breath, chest pain, and extreme fatigue.		/tmp/screenshots/2020-09-17/google_soreness covid-p1.png
0	24	1	soreness covid	21	results	https://www.mayoclinic.org/diseases-conditions/coronavirus/expert-answers/coronavirus-unusual-symptoms/faq-20487367		Unusual coronavirus (COVID-19) symptoms: What are they ...www.mayoclinic.org › expert-answers › faq-20487367	www.mayoclinic.org	www.mayoclinic.org › expert-answers › faq-20487367	Jun 30, 2020 - Other symptoms include shortness of breath or difficulty breathing, muscle aches, chills, sore throat, headache, or chest pain. But COVID-19 ...		/tmp/screenshots/2020-09-17/google_soreness covid-p1.png
0	24	1	soreness covid	22	results	https://www.prevention.com/health/a32281875/coronavirus-symptom-muscle-pain/		Are Muscle Aches and Pains a Coronavirus Symptom ...www.prevention.com › health › coronavirus-symptom-...	www.prevention.com	www.prevention.com › health › coronavirus-symptom-...	Apr 27, 2020 - Coronavirus can cause muscle pain, and the COVID-19 symptom may be more common than a sore throat, headaches, and chills. Here's when ...		/tmp/screenshots/2020-09-17/google_soreness covid-p1.png
0	24	1	soreness covid	23	results	https://www.prevention.com/health/a34040590/chest-pain-coronavirus-covid-19-symptom/		Is Chest Pain a Symptom of COVID-19? Here's What Doctors ...www.prevention.com › health › chest-pain-coronavirus...	www.prevention.com	www.prevention.com › health › chest-pain-coronavirus...	20 hours ago - Some COVID-19 patients report chest pain as a symptom of the novel coronavirus. Experts explain why this can happen, plus why you ...		/tmp/screenshots/2020-09-17/google_soreness covid-p1.png
0	24	1	soreness covid	24	results	https://www.statnews.com/2020/07/08/my-covid-19-symptoms-lasted-100-plus-days/		My Covid-19 symptoms have lasted 100-plus days. I'm not ...www.statnews.com › 2020/07/08 › my-covid-19-sympt...	www.statnews.com	www.statnews.com › 2020/07/08 › my-covid-19-sympt...	Jul 8, 2020 - My first Covid-19 symptoms appeared on March 14: a low-grade fever, profound leg pain, malaise, and loss of appetite. More than 100 days ...		/tmp/screenshots/2020-09-17/google_soreness covid-p1.png
0	24	1	soreness covid	25	results	https://www.healthcentral.com/condition/coronavirus		Coronavirus Signs, Symptoms, FAQs, and Treatmentswww.healthcentral.com › condition › coronavirus	www.healthcentral.com	www.healthcentral.com › condition › coronavirus	Jul 24, 2020 - About 14% of people with COVID-19 had a sore throat. Muscle and joint pain. Joint aches happen in 14.8% of cases. THe areas you feel pain can ...		/tmp/screenshots/2020-09-17/google_soreness covid-p1.png
0	25	1	ageusia coronavirus	1	results	https://www.cdc.gov/coronavirus/2019-ncov/symptoms-testing/index.html#:~:text=Call%20your%20doctor:%20If,provider%20for%20medical%20advice.		Symptoms of Coronaviruswww.cdc.gov › 2019-ncov › symptoms-testing	www.cdc.gov	www.cdc.gov › 2019-ncov › symptoms-testing			/tmp/screenshots/2020-09-17/google_ageusia coronavirus-p1.png
0	25	1	ageusia coronavirus	3	results	https://www.ncbi.nlm.nih.gov/pmc/articles/PMC7211515/		Prevalence and Duration of Acute Loss of Smell or Taste in ...www.ncbi.nlm.nih.gov › pmc › articles › PMC7211515	www.ncbi.nlm.nih.gov	www.ncbi.nlm.nih.gov › pmc › articles › PMC7211515	May 6, 2020 - Initially, acute loss of smell (anosmia) and taste (ageusia) was not considered important symptoms for coronavirus disease 2019 (COVID-19).		/tmp/screenshots/2020-09-17/google_ageusia coronavirus-p1.png
0	25	1	ageusia coronavirus	4	results	https://www.ncbi.nlm.nih.gov/pmc/articles/PMC7228304/		Anosmia and Ageusia: Common Findings in COVID‐19 Patientswww.ncbi.nlm.nih.gov › pmc › articles › PMC7228304	www.ncbi.nlm.nih.gov	www.ncbi.nlm.nih.gov › pmc › articles › PMC7228304	In a not negligible number of patients affected by COVID‐19 (coronavirus disease 2019), especially if paucisymptomatic, anosmia and ageusia can represent ...		/tmp/screenshots/2020-09-17/google_ageusia coronavirus-p1.png
