query_num_results_total	query_num_results_page	query_page_number	query	serp_rank	serp_type	serp_url	serp_rating	serp_title	serp_domain	serp_visible_link	serp_snippet	serp_sitelinks	screenshot
0	19	1	thermometer covid	13	results	https://www.nbcnews.com/shopping/wellness/best-thermometers-n1237174		The best digital thermometers for at-home use - NBC Newswww.nbcnews.com › shopping › wellness › best-therm...	www.nbcnews.com	www.nbcnews.com › shopping › wellness › best-therm...	Aug 19, 2020 - Coronavirus shopping 2020. What is the best thermometer? Shop the best fever thermometer and non contact thermometer for adults right now ...		/tmp/screenshots/2020-09-17/google_thermometer covid-p1.png
0	19	1	thermometer covid	14	results	https://www.hackensackmeridianhealth.org/HealthU/2020/03/31/how-to-take-your-temperature-to-check-for-a-fever/		How to Take Your Temperature to Check for a Fever - COVID ...www.hackensackmeridianhealth.org › News	www.hackensackmeridianhealth.org	www.hackensackmeridianhealth.org › News	Mar 31, 2020 - Children ages 4 and above and adults can use oral thermometers. “It is important to note which thermometer is which, rectal thermometers should ...		/tmp/screenshots/2020-09-17/google_thermometer covid-p1.png
0	19	1	thermometer covid	15	results	https://www.eways-aviation.com/en/infrared-thermometer-covid-19/		Infrared Thermometer to fight Covid-19 | Eways Aviationwww.eways-aviation.com › infrared-thermometer-covi...	www.eways-aviation.com	www.eways-aviation.com › infrared-thermometer-covi...	May 22, 2020 - Airlines need the best Infrared Thermometers to fight Covid-19 and ensure the security of their staff, passengers and crews.		/tmp/screenshots/2020-09-17/google_thermometer covid-p1.png
0	19	1	thermometer covid	16	results	https://www.healthcareitnews.com/news/digital-thermometer-data-may-provide-insight-covid-19-surges		Digital thermometer data may provide insight into COVID-19 ...www.healthcareitnews.com › news › digital-thermomet...	www.healthcareitnews.com	www.healthcareitnews.com › news › digital-thermomet...	"Mar 26, 2020 - This heat map from Kinsa Health indicates a recent increase in fevers in Florida that preceded a rise in coronavirus cases. A digital ""smart"" ..."		/tmp/screenshots/2020-09-17/google_thermometer covid-p1.png
0	19	1	thermometer covid	17	results	https://blog.cheapism.com/best-thermometers/		Digital Infrared Forehead Thermometers for COVID-19 Testing ...blog.cheapism.com › best-thermometers	blog.cheapism.com	blog.cheapism.com › best-thermometers	Jul 9, 2020 - Protect yourself against possible COVID-19 infection by checking your temperature with a no-touch infrared thermometer. Digital temporal ...		/tmp/screenshots/2020-09-17/google_thermometer covid-p1.png
0	19	1	thermometer covid	18	results	https://health.clevelandclinic.org/are-infrared-thermometers-accurate/		Are Infrared Thermometers Accurate? – Health Essentials ...health.clevelandclinic.org › are-infrared-thermometers-...	health.clevelandclinic.org	health.clevelandclinic.org › are-infrared-thermometers-...	Jun 5, 2020 - Q: I've had my temperature checked with a hand-held thermometer for work or when entering a building during coronavirus, but is it actually ...		/tmp/screenshots/2020-09-17/google_thermometer covid-p1.png
0	19	1	thermometer covid	19	results	https://apnews.com/afs:Content:9121703294		Infrared thermometers used for COVID-19 testing do not pose ...apnews.com › afs:Content:9121703294	apnews.com	apnews.com › afs:Content:9121703294	Jul 28, 2020 - CLAIM: Infrared thermometers, which are held near the forehead to scan body temperature without direct contact, point an infrared light directly ...		/tmp/screenshots/2020-09-17/google_thermometer covid-p1.png
0	24	1	fever coronavirus	1	results	https://www.cdc.gov/coronavirus/2019-ncov/symptoms-testing/index.html#:~:text=Call%20your%20doctor:%20If,provider%20for%20medical%20advice.		Symptoms of Coronaviruswww.cdc.gov › 2019-ncov › symptoms-testing	www.cdc.gov	www.cdc.gov › 2019-ncov › symptoms-testing			/tmp/screenshots/2020-09-17/google_fever coronavirus-p1.png
0	24	1	fever coronavirus	3	results	https://www.cdc.gov/coronavirus/2019-ncov/if-you-are-sick/steps-when-sick.html#:~:text=If%20you%20have%20a%20fever,track%20of%20your%20symptoms.		What to Do If You Are Sickwww.cdc.gov › if-you-are-sick › steps-when-sick	www.cdc.gov	www.cdc.gov › if-you-are-sick › steps-when-sick			/tmp/screenshots/2020-09-17/google_fever coronavirus-p1.png
0	24	1	fever coronavirus	5	results	https://www1.nyc.gov/site/doh/covid/covid-19-symptoms-chronic-health-risks.page#:~:text=People%20with%20the%20following%20symptoms,get%20them%20for%20you.		COVID-19: Symptoms and What to Do When Sickwww1.nyc.gov › covid-19-symptoms-chronic-health-risks	www1.nyc.gov	www1.nyc.gov › covid-19-symptoms-chronic-health-risks			/tmp/screenshots/2020-09-17/google_fever coronavirus-p1.png
0	24	1	fever coronavirus	6	results	https://www.who.int/maldives/news/detail/31-01-2020-updates-on-novel-corona-virus-(COVID-19)#:~:text=The%20virus%20can%20cause%20a,and%20deaths%20can%20occur.		Updates on Novel Corona Virus (COVID-19)www.who.int › maldives › news › detail › 31-01-2020-up...	www.who.int	www.who.int › maldives › news › detail › 31-01-2020-up...			/tmp/screenshots/2020-09-17/google_fever coronavirus-p1.png
0	24	1	fever coronavirus	7	results	https://health.mountsinai.org/blog/i-think-i-have-covid-19-how-can-i-take-care-of-myself-at-home/#:~:text=The%20best%20way%20to%20treat,directions%20on%20the%20package.		Riding Out COVID-19 at Home | Mount Sinai Todayhealth.mountsinai.org › blog › i-think-i-have-covid-19-h...	health.mountsinai.org	health.mountsinai.org › blog › i-think-i-have-covid-19-h...			/tmp/screenshots/2020-09-17/google_fever coronavirus-p1.png
0	24	1	fever coronavirus	8	results	https://www.cdc.gov/coronavirus/2019-ncov/symptoms-testing/symptoms.html		Symptoms of Coronavirus | CDCwww.cdc.gov › 2019-ncov › symptoms-testing › sympt...	www.cdc.gov	www.cdc.gov › 2019-ncov › symptoms-testing › sympt...	May 13, 2020 - People with COVID-19 have had a wide range of symptoms reported – ranging from mild symptoms to severe illness. Symptoms may appear 2-14 days after exposure to the virus. People with these symptoms may have COVID-19: Fever or chills.		/tmp/screenshots/2020-09-17/google_fever coronavirus-p1.png
0	24	1	fever coronavirus	9	results	https://www.cdc.gov/coronavirus/2019-ncov/if-you-are-sick/steps-when-sick.html		What to Do If You Are Sick | CDCwww.cdc.gov › if-you-are-sick › steps-when-sick	www.cdc.gov	www.cdc.gov › if-you-are-sick › steps-when-sick	If you have a fever, cough or other symptoms, you might have COVID-19. ... Coronavirus Self-Checker is a tool to help you make decisions on when to seek ...		/tmp/screenshots/2020-09-17/google_fever coronavirus-p1.png
0	24	1	fever coronavirus	10	results	https://www.hopkinsmedicine.org/health/conditions-and-diseases/coronavirus/coronavirus-symptoms-frequently-asked-questions		Coronavirus Symptoms: Frequently Asked Questions | Johns ...www.hopkinsmedicine.org › conditions-and-diseases	www.hopkinsmedicine.org	www.hopkinsmedicine.org › conditions-and-diseases	Jun 26, 2020 - What are symptoms of coronavirus (COVID-19)? · Cough · Fever or chills · Shortness of breath or difficulty breathing · Muscle or body aches · Sore ...		/tmp/screenshots/2020-09-17/google_fever coronavirus-p1.png
0	24	1	fever coronavirus	11	results	https://www.webmd.com/lung/covid-19-symptoms		Symptoms of Coronavirus: Early Signs, Serious Symptoms ...www.webmd.com › ... › Coronavirus › Reference	www.webmd.com	www.webmd.com › ... › Coronavirus › Reference	Jump to How to Check for Fever - Fever: 99% · Fatigue:70% · A dry cough: 59% · Loss of appetite: 40% · Body aches: 35% · Shortness of breath: 31% · Mucus or ...		/tmp/screenshots/2020-09-17/google_fever coronavirus-p1.png
0	24	1	fever coronavirus	12	results	https://www.health.com/condition/infectious-diseases/coronavirus/what-temperature-is-considered-a-fever-in-adults		What Temperature is Considered a Fever in Adults? | Health ...www.health.com › Infectious Diseases › Coronavirus	www.health.com	www.health.com › Infectious Diseases › Coronavirus	Apr 2, 2020 - Fever is the most common coronavirus symptom, affecting up to 88 percent of those infected, according to the World Health Organization.		/tmp/screenshots/2020-09-17/google_fever coronavirus-p1.png
0	24	1	fever coronavirus	13	results	https://www.healthline.com/health/coronavirus-covid-19		2019 Coronavirus (COVID-19): Symptoms, Treatment, and ...www.healthline.com › health › coronavirus-covid-19	www.healthline.com	www.healthline.com › health › coronavirus-covid-19	The 2019 novel coronavirus (COVID-19) is a new type of coronavirus. ... severe over time; a low-grade fever that gradually increases in temperature; fatigue.		/tmp/screenshots/2020-09-17/google_fever coronavirus-p1.png
0	24	1	fever coronavirus	14	results	https://www.singlecare.com/blog/news/coronavirus-symptoms-and-incubation-period/		Coronavirus symptoms: Mild, moderate, severe - SingleCarewww.singlecare.com › blog › news › coronavirus-symp...	www.singlecare.com	www.singlecare.com › blog › news › coronavirus-symp...	Jul 29, 2020 - Low-grade fever (not more than 100 degrees Fahrenheit) · Dry cough · Fatigue · Headache · New loss of taste or smell · Gastrointestinal upset, ...		/tmp/screenshots/2020-09-17/google_fever coronavirus-p1.png
0	24	1	fever coronavirus	15	results	https://www.adventhealth.com/blog/how-treat-a-fever-coronavirus-home		How to Treat a Fever from Coronavirus at Home | AdventHealthwww.adventhealth.com › blog › how-treat-a-fever-coro...	www.adventhealth.com	www.adventhealth.com › blog › how-treat-a-fever-coro...	Apr 16, 2020 - Fever is one of the main symptoms of sickness from coronavirus infection, along with cough and shortness of breath. These symptoms can ...		/tmp/screenshots/2020-09-17/google_fever coronavirus-p1.png
0	24	1	fever coronavirus	16	results	https://khn.org/news/temperature-check-tips-for-tracking-a-key-symptom-of-coronavirus-contagion/		Temperature Check: Tips For Tracking A Key Symptom Of ...khn.org › news › temperature-check-tips-for-tracking-a...	khn.org	khn.org › news › temperature-check-tips-for-tracking-a...	Apr 1, 2020 - It's been two weeks, officially, and my only symptoms are cabin fever and existential anxiety. The coronavirus seemed a no-show. But was that ...		/tmp/screenshots/2020-09-17/google_fever coronavirus-p1.png
0	24	1	fever coronavirus	17	results	https://www.advisory.com/daily-briefing/2020/05/18/state-fever		Is 99.5 degrees a 'fever'? It's a surprisingly tricky question ...www.advisory.com › daily-briefing › 2020/05/18 › stat...	www.advisory.com	www.advisory.com › daily-briefing › 2020/05/18 › stat...	May 18, 2020 - As states begin to reopen nonessential businesses amid America's new coronavirus epidemic, the lack of a national strategy for screening ...		/tmp/screenshots/2020-09-17/google_fever coronavirus-p1.png
0	24	1	fever coronavirus	18	results	https://www.umms.org/coronavirus/what-to-know/treat-covid-at-home		Treating Coronavirus at Home | University of Maryland ...www.umms.org › what-to-know › treat-covid-at-home	www.umms.org	www.umms.org › what-to-know › treat-covid-at-home	The main symptoms of the novel coronavirus are fever, cough and shortness of breath. For a Fever. Take a fever reducer. If you choose to or if your fever is very ...		/tmp/screenshots/2020-09-17/google_fever coronavirus-p1.png
0	24	1	fever coronavirus	19	results	https://www.nfid.org/infectious-diseases/frequently-asked-questions-about-novel-coronavirus-2019-ncov/		Frequently Asked Questions About Novel Coronavirus (COVID ...www.nfid.org › infectious-diseases › frequently-asked-...	www.nfid.org	www.nfid.org › infectious-diseases › frequently-asked-...	How can you tell the difference between the novel coronavirus and a cold or influenza (flu)?. The symptoms are similar, including fever, cough, and shortness of ...		/tmp/screenshots/2020-09-17/google_fever coronavirus-p1.png
0	24	1	fever coronavirus	20	results	https://kidshealth.org/en/parents/coronavirus-child-is-sick.html		Coronavirus (COVID-19) Pandemic: What to Do if Your Child ...kidshealth.org › parents › coronavirus-child-is-sick	kidshealth.org	kidshealth.org › parents › coronavirus-child-is-sick	What Are the Signs & Symptoms of Coronavirus (COVID-19)? · fever · belly pain · vomiting or diarrhea · neck pain · a rash · red eyes · feeling very tired · red, cracked ...		/tmp/screenshots/2020-09-17/google_fever coronavirus-p1.png
0	24	1	fever coronavirus	21	results	https://www.vdh.virginia.gov/coronavirus/coronavirus/what-to-do-if-you-have-confirmed-or-suspected-coronavirus-disease-covid-19/		What to do if you have confirmed or suspected coronavirus ...www.vdh.virginia.gov › Coronavirus	www.vdh.virginia.gov	www.vdh.virginia.gov › Coronavirus	Symptoms of COVID-19 include fever or chills, cough, shortness of breath or difficulty breathing, fatigue, muscle or body aches, headache, new loss of taste or ...		/tmp/screenshots/2020-09-17/google_fever coronavirus-p1.png
0	24	1	fever coronavirus	22	results	https://www.hackensackmeridianhealth.org/HealthU/2020/03/31/how-to-take-your-temperature-to-check-for-a-fever/		How to Take Your Temperature to Check for a Fever - COVID ...www.hackensackmeridianhealth.org › News	www.hackensackmeridianhealth.org	www.hackensackmeridianhealth.org › News	Mar 31, 2020 - What is a fever? ... “For COVID-19, a high fever can be a presenting symptom, however there are ... I Think I Have Coronavirus, Now What?		/tmp/screenshots/2020-09-17/google_fever coronavirus-p1.png
0	24	1	fever coronavirus	23	results	https://www.consumerreports.org/medical-symptoms/fever-and-covid-19-what-to-know/		What to Know About Fever and COVID-19 - Consumer Reportswww.consumerreports.org › medical-symptoms › fever...	www.consumerreports.org	www.consumerreports.org › medical-symptoms › fever...	Apr 2, 2020 - When it comes to COVID-19, the disease caused by the novel coronavirus, it turns out not much is simple. Not even fever. Yes, it's clear that a ...		/tmp/screenshots/2020-09-17/google_fever coronavirus-p1.png
0	24	1	fever coronavirus	24	results	https://www.nytimes.com/article/coronavirus-temperature-fever-thermometer.html		Coronavirus and Fever Temperature: Tracking Symptoms with ...www.nytimes.com › Well › Live	www.nytimes.com	www.nytimes.com › Well › Live	Mar 30, 2020 - Temperature Check: Tracking Fever, a Key Symptom of Coronavirus. Taking one's temperature to look for signs of fever is not as easy as it ...		/tmp/screenshots/2020-09-17/google_fever coronavirus-p1.png
0	24	1	fever coronavirus	25	results	https://www.nytimes.com/2020/09/13/health/covid-fever-checks-dining.html		Are Fever Checks a Good Gatekeeper for Covid? - The New ...www.nytimes.com › 2020/09/13 › health › covid-fever-c...	www.nytimes.com	www.nytimes.com › 2020/09/13 › health › covid-fever-c...	3 days ago - There is ample reason for concern. Coronavirus outbreaks — like one in East Lansing, Mich., this summer that infected 187 people — have been ...		/tmp/screenshots/2020-09-17/google_fever coronavirus-p1.png
0	24	1	fever coronavirus	26	results	https://www.government.nl/topics/coronavirus-covid-19/frequently-asked-questions-about-coronavirus-and-health		Frequently asked questions about coronavirus and health ...www.government.nl › topics › coronavirus-covid-19	www.government.nl	www.government.nl › topics › coronavirus-covid-19	A temperature up to 38 degrees or a fever above 38 degrees; A sudden loss of smell or taste (without a blocked nose). I think I have coronavirus. What should I do?		/tmp/screenshots/2020-09-17/google_fever coronavirus-p1.png
0	25	1	shortness of breath coronavirus	1	results	https://www.cdc.gov/coronavirus/2019-ncov/symptoms-testing/index.html#:~:text=Call%20your%20doctor:%20If,provider%20for%20medical%20advice.		Symptoms of Coronaviruswww.cdc.gov › 2019-ncov › symptoms-testing	www.cdc.gov	www.cdc.gov › 2019-ncov › symptoms-testing			/tmp/screenshots/2020-09-17/google_shortness of breath coronavirus-p1.png
0	25	1	shortness of breath coronavirus	3	results	https://www.health.harvard.edu/diseases-and-conditions/covid-19-basics#:~:text=If%20shortness%20of%20breath%20is,is%20the%20likely%20problem.		COVID-19 basicswww.health.harvard.edu › diseases-and-conditions › covi...	www.health.harvard.edu	www.health.harvard.edu › diseases-and-conditions › covi...			/tmp/screenshots/2020-09-17/google_shortness of breath coronavirus-p1.png
0	25	1	shortness of breath coronavirus	5	results	https://www.cdc.gov/coronavirus/2019-ncov/if-you-are-sick/care-for-someone.html#:~:text=%2D%20Trouble%20breathing.%20%2D,Bluish%20lips%20or%20face.		COVID19 - Caring for someone at homewww.cdc.gov › coronavirus › 2019-ncov › if-you-are-sick	www.cdc.gov	www.cdc.gov › coronavirus › 2019-ncov › if-you-are-sick			/tmp/screenshots/2020-09-17/google_shortness of breath coronavirus-p1.png
0	25	1	shortness of breath coronavirus	6	results	https://www.who.int/maldives/news/detail/31-01-2020-updates-on-novel-corona-virus-(COVID-19)#:~:text=The%20virus%20can%20cause%20a,and%20deaths%20can%20occur.		Updates on Novel Corona Virus (COVID-19)www.who.int › maldives › news › detail › 31-01-2020-up...	www.who.int	www.who.int › maldives › news › detail › 31-01-2020-up...			/tmp/screenshots/2020-09-17/google_shortness of breath coronavirus-p1.png
0	25	1	shortness of breath coronavirus	7	results	https://www.health.harvard.edu/diseases-and-conditions/covid-19-basics#:~:text=Shortness%20of%20breath%20refers%20to,to%20call%20your%20doctor.		COVID-19 basicswww.health.harvard.edu › diseases-and-conditions › covi...	www.health.harvard.edu	www.health.harvard.edu › diseases-and-conditions › covi...			/tmp/screenshots/2020-09-17/google_shortness of breath coronavirus-p1.png
0	25	1	shortness of breath coronavirus	8	results	https://www.healthline.com/health/coronavirus-shortness-of-breath		Coronavirus and Shortness of Breath: What Does It Feel Like?www.healthline.com › health › coronavirus-shortness-o...	www.healthline.com	www.healthline.com › health › coronavirus-shortness-o...	Jun 5, 2020 - Shortness of breath can make it hard to breathe deeply. You may feel winded, or as if you can't get enough air into your lungs. Known clinically ...		/tmp/screenshots/2020-09-17/google_shortness of breath coronavirus-p1.png
0	25	1	shortness of breath coronavirus	9	results	https://www.goodrx.com/blog/shortness-of-breath-first-symptom-of-covid-19/		Is Shortness of Breath an Early Symptom of Coronavirus ...www.goodrx.com › ... › COVID-19 (Coronavirus)	www.goodrx.com	www.goodrx.com › ... › COVID-19 (Coronavirus)	Apr 9, 2020 - Sometimes, it can feel like tightness around the chest. The medical terms for these symptoms are “breathlessness” and “dyspnea.” Feeling short ...		/tmp/screenshots/2020-09-17/google_shortness of breath coronavirus-p1.png
0	25	1	shortness of breath coronavirus	10	results	https://www.hopkinsmedicine.org/health/conditions-and-diseases/coronavirus/coronavirus-recovery-breathing-exercises		Coronavirus Recovery: Breathing Exercises | Johns Hopkins ...www.hopkinsmedicine.org › conditions-and-diseases	www.hopkinsmedicine.org	www.hopkinsmedicine.org › conditions-and-diseases	COVID-19 often leads to pneumonia and even acute respiratory distress syndrome (ARDS), a severe lung injury. Recovering lung function is possible but can ...		/tmp/screenshots/2020-09-17/google_shortness of breath coronavirus-p1.png
0	25	1	shortness of breath coronavirus	11	results	https://www.cdc.gov/coronavirus/2019-ncov/symptoms-testing/symptoms.html		Symptoms of Coronavirus | CDCwww.cdc.gov › 2019-ncov › symptoms-testing › sympt...	www.cdc.gov	www.cdc.gov › 2019-ncov › symptoms-testing › sympt...	May 13, 2020 - Patients with confirmed SARS-CoV-2 infection have reportedly had mild to severe respiratory illness with symptoms of fever, cough, and ...		/tmp/screenshots/2020-09-17/google_shortness of breath coronavirus-p1.png
0	25	1	shortness of breath coronavirus	12	results	https://www.nebraskamed.com/COVID/shortness-of-breath-what-is-it-and-what-do-i-do-if-i-have-it		Shortness of breath: what is it and what do I do if I have it ...www.nebraskamed.com › COVID › shortness-of-breath...	www.nebraskamed.com	www.nebraskamed.com › COVID › shortness-of-breath...	"May 1, 2020 - Shortness of breath is one of the symptoms of COVID-19. You may wonder when ""shortness of breath"" is serious enough to go to the hospital."		/tmp/screenshots/2020-09-17/google_shortness of breath coronavirus-p1.png
0	25	1	shortness of breath coronavirus	13	results	https://www.health.harvard.edu/diseases-and-conditions/covid-19-basics		COVID-19 basics - Harvard Healthwww.health.harvard.edu › diseases-and-conditions › co...	www.health.harvard.edu	www.health.harvard.edu › diseases-and-conditions › co...	Aug 21, 2020 - When the virus does cause symptoms, common ones include fever, body ache, dry cough, fatigue, chills, headache, sore throat, loss of appetite, ...		/tmp/screenshots/2020-09-17/google_shortness of breath coronavirus-p1.png
0	25	1	shortness of breath coronavirus	14	results	https://www.medpagetoday.com/infectiousdisease/covid19/86002		Dyspnea and COVID-19: It's All in the Timing | MedPage Todaywww.medpagetoday.com › infectiousdisease › covid19	www.medpagetoday.com	www.medpagetoday.com › infectiousdisease › covid19	Apr 13, 2020 - Timing of dyspnea may be one of the most important hallmarks of COVID-19 coronavirus infection, especially for clinicians seeing patients in an ...		/tmp/screenshots/2020-09-17/google_shortness of breath coronavirus-p1.png
0	25	1	shortness of breath coronavirus	15	results	https://www.talktomira.com/post/what-does-shortness-of-breath-feel-like-a-doctor-explains-coronavirus-symptoms		What Does Shortness of Breath Feel Like? A Lung Doctor ...www.talktomira.com › post › what-does-shortness-of-b...	www.talktomira.com	www.talktomira.com › post › what-does-shortness-of-b...	Apr 19, 2020 - Coronavirus COVID-19 is a respiratory disease, so it's widely known that there's an effect on the lungs. Some symptoms include a fever, a dry ...		/tmp/screenshots/2020-09-17/google_shortness of breath coronavirus-p1.png
0	25	1	shortness of breath coronavirus	16	results	https://baptisthealth.net/baptist-health-news/shortness-of-breath-understanding-this-vital-covid-19-symptom/		Shortness of Breath: Understanding This Vital COVID-19 ...baptisthealth.net › baptist-health-news › shortness-of-br...	baptisthealth.net	baptisthealth.net › baptist-health-news › shortness-of-br...	Apr 20, 2020 - Many people with asthma, heart disease, chronic lung disease and those who smoke may suffer from occasional shortness of breath, like when ...		/tmp/screenshots/2020-09-17/google_shortness of breath coronavirus-p1.png
0	25	1	shortness of breath coronavirus	17	results	https://healthcare.utah.edu/the-scope/shows.php?shows=0_0s956sjk		Shortness of Breath: Anxiety or Coronavirus? | University of ...healthcare.utah.edu › the-scope › shows	healthcare.utah.edu	healthcare.utah.edu › the-scope › shows	Apr 30, 2020 - You can't take a deep breath and your chest hurts and your heart is pounding. Is this coronavirus, or is it a panic attack? These are anxious times.		/tmp/screenshots/2020-09-17/google_shortness of breath coronavirus-p1.png
0	25	1	shortness of breath coronavirus	18	results	https://www.hackensackmeridianhealth.org/HealthU/2020/04/28/is-my-shortness-of-breath-an-anxiety-attack-or-coronavirus/		Is My Shortness of Breath an Anxiety Attack or Coronavirus ...www.hackensackmeridianhealth.org › News	www.hackensackmeridianhealth.org	www.hackensackmeridianhealth.org › News	Apr 28, 2020 - A common symptom associated with both COVID-19 and an anxiety attack (or panic attack disorder) is shortness of breath.		/tmp/screenshots/2020-09-17/google_shortness of breath coronavirus-p1.png
0	25	1	shortness of breath coronavirus	19	results	https://elite24er.com/tag/shortness-of-breath/		Shortness of Breath Archives - Elite Care 24 Hour Emergency ...elite24er.com › tag › shortness-of-breath	elite24er.com	elite24er.com › tag › shortness-of-breath	... a lot of different medical conditions can cause sudden shortness of breath: asthma, chest infection, heart disease, anxiety, panic attacks, and yes — COVID-19.		/tmp/screenshots/2020-09-17/google_shortness of breath coronavirus-p1.png
0	25	1	shortness of breath coronavirus	20	results	https://www.webmd.com/lung/covid-19-symptoms		Symptoms of Coronavirus: Early Signs, Serious Symptoms ...www.webmd.com › ... › Coronavirus › Reference	www.webmd.com	www.webmd.com › ... › Coronavirus › Reference	Jump to What Does Shortness of Breath Feel Like? - COVID-19 is a respiratory condition caused by a coronavirus. Some people are infected but don't notice ...		/tmp/screenshots/2020-09-17/google_shortness of breath coronavirus-p1.png
0	25	1	shortness of breath coronavirus	21	results	https://www.houstonmethodist.org/blog/articles/2020/jul/what-does-coronavirus-do-to-the-lungs/		What Does Coronavirus Do to the Lungs? | Houston Methodist ...www.houstonmethodist.org › blog › articles › jul › wha...	www.houstonmethodist.org	www.houstonmethodist.org › blog › articles › jul › wha...	Jul 20, 2020 - We do know that COVID-19 is an upper respiratory illness that infected people can easily spread as they breathe, speak, clear their throat, ...		/tmp/screenshots/2020-09-17/google_shortness of breath coronavirus-p1.png
