query_num_results_total	query_num_results_page	query_page_number	query	serp_rank	serp_type	serp_url	serp_rating	serp_title	serp_domain	serp_visible_link	serp_snippet	serp_sitelinks	screenshot
0	24	1	soreness coronavirus	8	results	https://www.webmd.com/lung/news/20200508/doctors-update-warning-signs-of-severe-covid		Doctors update warning signs of severe COVID - WebMDwww.webmd.com › ... › Coronavirus › News	www.webmd.com	www.webmd.com › ... › Coronavirus › News	"May 8, 2020 - It can also present with severe body aches and exhaustion,"" Cohen's group explained in a Harvard news release. Another key sign of coronavirus ..."		/tmp/screenshots/2020-09-17/google_soreness coronavirus-p1.png
0	24	1	soreness coronavirus	9	results	https://www.chifranciscan.org/content/dam/chi-franciscan/CHI_Coronavirus_Flyer_v3.pdf		Is it Flu or COVID-19 Coronavirus Disease? - CHI Franciscanwww.chifranciscan.org › content › dam › CHI_Corona...	www.chifranciscan.org	www.chifranciscan.org › content › dam › CHI_Corona...	Feeling very tired (fatigue). • Sore throat. • Runny or stuffy nose. • Fever. • Cough. • Difficulty breathing. • Shortness of breath. Coronavirus (COVID-19) is a new.		/tmp/screenshots/2020-09-17/google_soreness coronavirus-p1.png
0	24	1	soreness coronavirus	10	results	https://www.theladders.com/career-advice/3-easy-ways-to-tell-if-youre-sore-from-covid-19		This is what muscle pain from COVID-19 feels likewww.theladders.com › career-advice › 3-easy-ways-to-t...	www.theladders.com	www.theladders.com › career-advice › 3-easy-ways-to-t...	May 3, 2020 - There are three sure-fire ways to distinguish pedestrian aches and pains from those caused by coronavirus.		/tmp/screenshots/2020-09-17/google_soreness coronavirus-p1.png
0	24	1	soreness coronavirus	11	results	http://www.cdc.gov/coronavirus/2019-ncov/downloads/COVID19-symptoms.pdf		Symptoms of Coronavirus (COVID-19) - CDCwww.cdc.gov › coronavirus › 2019-ncov › downloads	www.cdc.gov	www.cdc.gov › coronavirus › 2019-ncov › downloads	Symptoms of Coronavirus (COVID-19) cdc.gov/coronavirus. 316475-A 07/21/2020. Know the ... Muscle or body aches. New loss of taste or smell. Vomiting or ...		/tmp/screenshots/2020-09-17/google_soreness coronavirus-p1.png
0	24	1	soreness coronavirus	12	results	https://www.nytimes.com/2020/08/05/well/live/coronavirus-covid-symptoms.html		The Many Symptoms of Covid-19 - The New York Timeswww.nytimes.com › Well › Live	www.nytimes.com	www.nytimes.com › Well › Live	Aug 6, 2020 - From a sniffle or cough that feels like allergies to severe body aches and crippling fatigue, the symptoms of coronavirus can be unpredictable ...		/tmp/screenshots/2020-09-17/google_soreness coronavirus-p1.png
0	24	1	soreness coronavirus	13	results	https://www.mayoclinic.org/diseases-conditions/coronavirus/expert-answers/coronavirus-unusual-symptoms/faq-20487367		Unusual coronavirus (COVID-19) symptoms: What are they ...www.mayoclinic.org › expert-answers › faq-20487367	www.mayoclinic.org	www.mayoclinic.org › expert-answers › faq-20487367	Jun 30, 2020 - Other symptoms include shortness of breath or difficulty breathing, muscle aches, chills, sore throat, headache, or chest pain. But COVID-19 can ...		/tmp/screenshots/2020-09-17/google_soreness coronavirus-p1.png
0	24	1	soreness coronavirus	14	results	https://www.healthcentral.com/condition/coronavirus		Coronavirus Signs, Symptoms, FAQs, and Treatmentswww.healthcentral.com › condition › coronavirus	www.healthcentral.com	www.healthcentral.com › condition › coronavirus	Jul 24, 2020 - Fever. This is the most prevalent symptom, occurring in about 88% of people. · Cough. · Shortness of breath. · Fatigue. · Sputum production. · Sore ...		/tmp/screenshots/2020-09-17/google_soreness coronavirus-p1.png
0	24	1	soreness coronavirus	15	results	https://www.health.harvard.edu/diseases-and-conditions/covid-19-basics		COVID-19 basics - Harvard Healthwww.health.harvard.edu › diseases-and-conditions › co...	www.health.harvard.edu	www.health.harvard.edu › diseases-and-conditions › co...	Aug 21, 2020 - As we continually learn more about coronavirus and COVID-19, ... the virus does cause symptoms, common ones include fever, body ache, dry ...		/tmp/screenshots/2020-09-17/google_soreness coronavirus-p1.png
0	24	1	soreness coronavirus	16	results	https://www.uhhospitals.org/services/coronavirus		Coronavirus: What You Need to Know About Symptoms ...www.uhhospitals.org › services › coronavirus	www.uhhospitals.org	www.uhhospitals.org › services › coronavirus	The coronavirus first seen in China has now been detected in the United States. Should you be worried? Learn about coronavirus symptoms and what to do if ...		/tmp/screenshots/2020-09-17/google_soreness coronavirus-p1.png
0	24	1	soreness coronavirus	17	results	https://www.prevention.com/health/a32281875/coronavirus-symptom-muscle-pain/		Are Muscle Aches and Pains a Coronavirus Symptom ...www.prevention.com › health › coronavirus-symptom-...	www.prevention.com	www.prevention.com › health › coronavirus-symptom-...	Apr 27, 2020 - Coronavirus can cause muscle pain, and the COVID-19 symptom may be more common than a sore throat, headaches, and chills. Here's when ...		/tmp/screenshots/2020-09-17/google_soreness coronavirus-p1.png
0	24	1	soreness coronavirus	18	results	https://intermountainhealthcare.org/health-information/germwatch/germ-school/coronavirus/		Coronavirus | Intermountain Healthcareintermountainhealthcare.org › ... › GermWatch	intermountainhealthcare.org	intermountainhealthcare.org › ... › GermWatch	Coronaviruses usually cause “common cold” symptoms like runny or stuffy nose, sneezing, sore throat, headache, cough, mild fever, and body aches. Infection can ...		/tmp/screenshots/2020-09-17/google_soreness coronavirus-p1.png
0	24	1	soreness coronavirus	19	results	https://www.medstarhealth.org/medstar-blog/is-sore-throat-a-common-covid-19-symptom/		Is sore throat a common COVID-19 ... - MedStar Health Blogwww.medstarhealth.org › medstar-blog › is-sore-throat-...	www.medstarhealth.org	www.medstarhealth.org › medstar-blog › is-sore-throat-...	Aug 5, 2020 - While sore throat can be a symptom of COVID-19, it's not common. Here's what you need to know about COVID-19 and sore throat.		/tmp/screenshots/2020-09-17/google_soreness coronavirus-p1.png
0	24	1	soreness coronavirus	20	results	https://www.vox.com/first-person/2020/3/28/21197480/coronavirus-symptoms-covid-19		Coronavirus symptoms: 5 people who tested positive on what ...www.vox.com › first-person › coronavirus-symptoms-c...	www.vox.com	www.vox.com › first-person › coronavirus-symptoms-c...	Mar 28, 2020 - First-person essays and interviews with unique perspectives on complicated issues. Shortness of breath, chest pains, fatigue, aches, coughs, ...		/tmp/screenshots/2020-09-17/google_soreness coronavirus-p1.png
0	24	1	soreness coronavirus	21	results	https://www.eatthis.com/covid-subtle-signs/		25 Subtle Signs You've Caught Coronavirus | Eat This Not Thatwww.eatthis.com › covid-subtle-signs	www.eatthis.com	www.eatthis.com › covid-subtle-signs	Aug 25, 2020 - Body aches and muscle soreness commonly accompany a fever. If you know you have a fever, it's no surprise that you're also feeling some ...		/tmp/screenshots/2020-09-17/google_soreness coronavirus-p1.png
0	24	1	soreness coronavirus	22	results	https://www.nbcnews.com/health/health-news/muscle-aches-extreme-fatigue-coronavirus-symptoms-go-beyond-fever-cough-n1173876		Muscle aches, extreme fatigue: Coronavirus symptoms go ...www.nbcnews.com › health › health-news › muscle-ac...	www.nbcnews.com	www.nbcnews.com › health › health-news › muscle-ac...	Apr 2, 2020 - Muscle aches, extreme fatigue: Coronavirus symptoms go beyond fever and cough. Some of the first warning signs can include extreme fatigue ...		/tmp/screenshots/2020-09-17/google_soreness coronavirus-p1.png
0	24	1	soreness coronavirus	23	results	https://www.nfid.org/infectious-diseases/coronaviruses/		Coronaviruses – National Foundation for Infectious Diseaseswww.nfid.org › infectious-diseases › coronaviruses	www.nfid.org	www.nfid.org › infectious-diseases › coronaviruses	sore throat. Additional symptoms have been reported with COVID-19. Human coronaviruses can cause other more serious illnesses, such as pneumonia or ...		/tmp/screenshots/2020-09-17/google_soreness coronavirus-p1.png
0	24	1	soreness coronavirus	24	results	https://www.advisory.com/daily-briefing/2020/05/20/covid-symptoms		Hallucinations, 'Covid toes,' and more: The emerging ...www.advisory.com › 2020/05/20 › covid-symptoms	www.advisory.com	www.advisory.com › 2020/05/20 › covid-symptoms	May 20, 2020 - When the new coronavirus first began spreading, physicians around the ... muscle pain, headache, sore throat, loss of smell, and loss of taste.		/tmp/screenshots/2020-09-17/google_soreness coronavirus-p1.png
0	24	1	soreness coronavirus	25	results	https://www.theguardian.com/world/2020/may/01/lingering-and-painful-long-and-unclear-road-to-coronavirus-recovery-long-lasting-symptoms		Lingering and painful: the long and unclear road to ...www.theguardian.com › world › may › lingering-and-...	www.theguardian.com	www.theguardian.com › world › may › lingering-and-...	May 1, 2020 - Coronavirus outbreak. This article is more than 4 months old. Lingering and painful: the long and unclear road to coronavirus recovery.		/tmp/screenshots/2020-09-17/google_soreness coronavirus-p1.png
0	25	1	ageusia covid	1	results	https://www.cdc.gov/coronavirus/2019-ncov/symptoms-testing/index.html#:~:text=Call%20your%20doctor:%20If,provider%20for%20medical%20advice.		Symptoms of Coronaviruswww.cdc.gov › 2019-ncov › symptoms-testing	www.cdc.gov	www.cdc.gov › 2019-ncov › symptoms-testing			/tmp/screenshots/2020-09-17/google_ageusia covid-p1.png
0	25	1	ageusia covid	3	results	https://www.ncbi.nlm.nih.gov/pmc/articles/PMC7228304/		Anosmia and Ageusia: Common Findings in COVID‐19 Patientswww.ncbi.nlm.nih.gov › pmc › articles › PMC7228304	www.ncbi.nlm.nih.gov	www.ncbi.nlm.nih.gov › pmc › articles › PMC7228304	In a not negligible number of patients affected by COVID‐19 (coronavirus disease 2019), especially if paucisymptomatic, anosmia and ageusia can represent ...		/tmp/screenshots/2020-09-17/google_ageusia covid-p1.png
0	25	1	ageusia covid	4	results	https://www.ncbi.nlm.nih.gov/pmc/articles/PMC7211515/		Prevalence and Duration of Acute Loss of Smell or Taste in ...www.ncbi.nlm.nih.gov › pmc › articles › PMC7211515	www.ncbi.nlm.nih.gov	www.ncbi.nlm.nih.gov › pmc › articles › PMC7211515	May 6, 2020 - Initially, acute loss of smell (anosmia) and taste (ageusia) was not considered important symptoms for coronavirus disease 2019 (COVID-19).		/tmp/screenshots/2020-09-17/google_ageusia covid-p1.png
0	25	1	ageusia covid	5	results	https://journals.lww.com/pidj/Fulltext/2020/08000/Anosmia_and_Ageusia__Not_an_Uncommon_Presentation.28.aspx		Anosmia and Ageusia: Not an Uncommon Presentation of ...journals.lww.com › pidj › Fulltext › Anosmia_and_Ageus...	journals.lww.com	journals.lww.com › pidj › Fulltext › Anosmia_and_Ageus...	Anosmia and Ageusia: Not an Uncommon Presentation of COVID-19 Infection in Children and Adolescents. Mak, Phoebe Qiaozhen MBBS; Chung, Ka-Shing ...		/tmp/screenshots/2020-09-17/google_ageusia covid-p1.png
0	25	1	ageusia covid	6	results	https://www.spandidos-publications.com/10.3892/etm.2020.8808		Anosmia and ageusia associated with coronavirus infection ...www.spandidos-publications.com › etm.2020.8808	www.spandidos-publications.com	www.spandidos-publications.com › etm.2020.8808	May 28, 2020 - Anosmia (loss of smell), and ageusia (loss of taste) become more frequently cited as independent symptoms or in association with the most ...		/tmp/screenshots/2020-09-17/google_ageusia covid-p1.png
0	25	1	ageusia covid	7	results	https://www.cureus.com/articles/30810-anosmia-and-ageusia-as-the-only-indicators-of-coronavirus-disease-2019-covid-19		Anosmia and Ageusia as the Only Indicators of ... - Cureuswww.cureus.com › articles › 30810-anosmia-and-ageus...	www.cureus.com	www.cureus.com › articles › 30810-anosmia-and-ageus...	May 1, 2020 - COVID-19, or coronavirus disease 2019, originated from Wuhan, China, in December 2019. It is caused by novel enveloped single-stranded ...		/tmp/screenshots/2020-09-17/google_ageusia covid-p1.png
0	25	1	ageusia covid	8	results	https://onlinelibrary.wiley.com/doi/full/10.1002/hed.26204		Objective evaluation of anosmia and ageusia in COVID‐19 ...onlinelibrary.wiley.com › doi › full › hed	onlinelibrary.wiley.com	onlinelibrary.wiley.com › doi › full › hed	Apr 27, 2020 - Abstract Background The first European case series are detecting a very high frequency of chemosensitive disorders in COVID‐19 patients, ...		/tmp/screenshots/2020-09-17/google_ageusia covid-p1.png
0	25	1	ageusia covid	9	results	https://www.mayoclinicproceedings.org/article/S0025-6196(20)30546-2/pdf		Smell and Taste Dysfunction in Patients With COVID-19: A ...www.mayoclinicproceedings.org › article › pdf	www.mayoclinicproceedings.org	www.mayoclinicproceedings.org › article › pdf	order or smell dysfunction or ageusia or hypogeusia or dysgeusia or taste dysfunction or gustatory dysfunction or neurological and. COVID-19 or 2019 novel ...		/tmp/screenshots/2020-09-17/google_ageusia covid-p1.png
0	25	1	ageusia covid	10	results	https://www.ncbi.nlm.nih.gov/pmc/articles/PMC7265845/#:~:text=Anosmia%20is%20a%20prominent%20sign,may%20also%20be%20presented.		COVID-19 and anosmia: A review based on up-to-date knowledgewww.ncbi.nlm.nih.gov › pmc › articles › PMC7265845	www.ncbi.nlm.nih.gov	www.ncbi.nlm.nih.gov › pmc › articles › PMC7265845			/tmp/screenshots/2020-09-17/google_ageusia covid-p1.png
0	25	1	ageusia covid	12	results	https://health.mountsinai.org/blog/i-think-i-have-covid-19-how-can-i-take-care-of-myself-at-home/#:~:text=This%20is%20one%20of%20the,Patrick%20Colley%2C%20MD.		Riding Out COVID-19 at Home | Mount Sinai Todayhealth.mountsinai.org › blog › i-think-i-have-covid-19-h...	health.mountsinai.org	health.mountsinai.org › blog › i-think-i-have-covid-19-h...			/tmp/screenshots/2020-09-17/google_ageusia covid-p1.png
0	25	1	ageusia covid	13	results	https://www.beckershospitalreview.com/public-health/covid-19-patients-may-not-recover-sense-of-taste-smell-after-other-symptoms-end.html#:~:text=According%20to%20preliminary%20data%20from,of%20other%20symptoms%20disappearing.		COVID-19 patients may not recover sense of taste, smell after other symptoms endwww.beckershospitalreview.com › public-health › covid-...	www.beckershospitalreview.com	www.beckershospitalreview.com › public-health › covid-...			/tmp/screenshots/2020-09-17/google_ageusia covid-p1.png
0	25	1	ageusia covid	14	results	https://www.houstonmethodist.org/coronavirus/#:~:text=If%20you're%20experiencing,have%20COVID%2D19.		Coronavirus Disease 2019 (COVID-19): What You Need to Knowwww.houstonmethodist.org › coronavirus	www.houstonmethodist.org	www.houstonmethodist.org › coronavirus			/tmp/screenshots/2020-09-17/google_ageusia covid-p1.png
0	25	1	ageusia covid	15	results	https://www.sciencedirect.com/science/article/pii/S2213007120303051		Anosmia: A marker of infection by the new corona virus ...www.sciencedirect.com › science › article › pii	www.sciencedirect.com	www.sciencedirect.com › science › article › pii	The objective of this case report is to describe anosmia and ageusia as emergent initial symptoms of COVID-19 (Coronavirus Disease 2019). 2. Case report.		/tmp/screenshots/2020-09-17/google_ageusia covid-p1.png
0	25	1	ageusia covid	16	results	https://europepmc.org/article/med/32237238		Anosmia and Ageusia: Common Findings in COVID-19 ...europepmc.org › article › med	europepmc.org	europepmc.org › article › med	In a not negligible number of patients affected by COVID-19 (coronavirus disease 2019), especially if paucisymptomatic, anosmia and ageusia can represent the ...		/tmp/screenshots/2020-09-17/google_ageusia covid-p1.png
0	25	1	ageusia covid	17	results	https://academic.oup.com/milmed/advance-article/doi/10.1093/milmed/usaa196/5890332		Case Report: COVID-19 Patient With Chief Complaint of ...academic.oup.com › milmed › doi › milmed › usaa196	academic.oup.com	academic.oup.com › milmed › doi › milmed › usaa196	Aug 10, 2020 - Multiple studies in Europe have implicated anosmia and ageusia as symptoms associated with COVID-19, and subsequently, anosmia and ...		/tmp/screenshots/2020-09-17/google_ageusia covid-p1.png
0	25	1	ageusia covid	18	results	https://www.researchgate.net/publication/340367283_Anosmia_and_Ageusia_Common_Findings_in_COVID-19_Patients		(PDF) Anosmia and Ageusia: Common Findings in COVID-19 ...www.researchgate.net › publication › 340367283_Anosm...	www.researchgate.net	www.researchgate.net › publication › 340367283_Anosm...	Aug 2, 2020 - PDF | In a not negligible number of patients affected by COVID‐19, especially if paucisymptomatic, ageusia and anosmia can represent the first ...		/tmp/screenshots/2020-09-17/google_ageusia covid-p1.png
0	25	1	ageusia covid	19	results	https://www.researchgate.net/publication/340897838_Potential_pathogenesis_of_ageusia_and_anosmia_in_COVID-19_patients		(PDF) Potential pathogenesis of ageusia and anosmia in ...www.researchgate.net › publication › 340897838_Potenti...	www.researchgate.net	www.researchgate.net › publication › 340897838_Potenti...	Jun 15, 2020 - PDF | From the first reports, ageusia and anosmia appear to be frequent clinical features in coronavirus disease 19 (COVID‐19) patients.		/tmp/screenshots/2020-09-17/google_ageusia covid-p1.png
0	25	1	ageusia covid	20	results	https://clinicaltrials.gov/ct2/show/NCT04388618		Investigating Anosmia and Ageusia in COVID-19 Adult ...clinicaltrials.gov › show › NCT04388618	clinicaltrials.gov	clinicaltrials.gov › show › NCT04388618	May 14, 2020 - Investigating Anosmia and Ageusia in COVID-19 Adult Patients in Saudi Arabia. The safety and scientific validity of this study is the responsibility ...		/tmp/screenshots/2020-09-17/google_ageusia covid-p1.png
0	25	1	ageusia covid	21	results	https://health.uconn.edu/tasteandsmell/general-information/		General Information | Taste and Smell - UConn Healthhealth.uconn.edu › tasteandsmell › general-information	health.uconn.edu	health.uconn.edu › tasteandsmell › general-information	Coronavirus (COVID-19) Information ... These include anosmia (complete smell loss), hyposmia (partial smell loss), ageusia (complete taste loss), hypogeusia ...		/tmp/screenshots/2020-09-17/google_ageusia covid-p1.png
0	25	1	ageusia covid	22	results	https://www.coronavirustoday.com/loss-smell-taste-indicates-coronavirus-infection-women		Loss of Smell & Taste Indicates Coronavirus Infection in Womenwww.coronavirustoday.com › loss-smell-taste-indicates-...	www.coronavirustoday.com	www.coronavirustoday.com › loss-smell-taste-indicates-...	Jun 20, 2020 - Anosmia or ageusia disorder may indicate coronavirus infection. ... The first findings of sensory loss associated with COVID-19 disease were ...		/tmp/screenshots/2020-09-17/google_ageusia covid-p1.png
0	25	1	ageusia covid	23	results	https://www.entnet.org/content/aao-hns-anosmia-hyposmia-and-dysgeusia-symptoms-coronavirus-disease		AAO-HNS: Anosmia, Hyposmia, and Dysgeusia Symptoms of ...www.entnet.org › content › aao-hns-anosmia-hyposmia...	www.entnet.org	www.entnet.org › content › aao-hns-anosmia-hyposmia...	"Mar 22, 2020 - [May 4] The World Health Organization added ""loss of taste or smell"" to its list of ""What are the symptoms of COVID-19?"" on its Q&A page."		/tmp/screenshots/2020-09-17/google_ageusia covid-p1.png
0	25	1	ageusia covid	24	results	https://www.nature.com/articles/s41415-020-2009-5		Anosmia and ageusia | British Dental Journal - Naturewww.nature.com › british dental journal › letters	www.nature.com	www.nature.com › british dental journal › letters	Aug 14, 2020 - Sir, loss of smell (anosmia) and loss of taste (ageusia) are symptoms that were identified in COVID-19 patients at the early stage of illness.		/tmp/screenshots/2020-09-17/google_ageusia covid-p1.png
0	25	1	ageusia covid	25	results	https://ecancer.org/en/journal/editorial/98-anosmia-and-ageusia-are-emerging-as-symptoms-in-patients-with-covid-19-what-does-the-current-evidence-say		Anosmia and ageusia are emerging as symptoms in patients ...ecancer.org › journal › editorial › 98-anosmia-and-age...	ecancer.org	ecancer.org › journal › editorial › 98-anosmia-and-age...	Apr 3, 2020 - One symptom, which has now been repeatedly reported in COVID-19 patients across Europe and Asia, is the loss of smell (anosmia) and taste ( ...		/tmp/screenshots/2020-09-17/google_ageusia covid-p1.png
0	25	1	ageusia covid	26	results	http://www.amjdent.com/Archive/ReviewArticles/2020/AJD%20JUNE%202020%20Passarelli.pdf		Taste and smell as chemosensory dysfunctions in COVID-19 ...www.amjdent.com › Archive › ReviewArticles	www.amjdent.com	www.amjdent.com › Archive › ReviewArticles	COVID-19 (SARS-CoV-2) infection: loss of taste (ageusia) and loss of smell (anosmia). Methods: PubMed and. EMBASE were searched and studies were ...		/tmp/screenshots/2020-09-17/google_ageusia covid-p1.png
0	25	1	ageusia covid	27	results	https://www.unboundmedicine.com/medline/citation/32516281/ANOSMIA_AND_AGEUSIA:_NOT_AN_UNCOMMON_PRESENTATION_OF_COVID-19_INFECTION_IN_CHILDREN_AND_ADOLESCENTS.		PRIME PubMed | Anosmia and Ageusia: Not an Uncommon ...www.unboundmedicine.com › medline › citation › AN...	www.unboundmedicine.com	www.unboundmedicine.com › medline › citation › AN...	Anosmia and Ageusia: Not an Uncommon Presentation of COVID-19 ... 2019, caused by severe acute respiratory syndrome coronavirus (SARS-CoV-2), a novel ...		/tmp/screenshots/2020-09-17/google_ageusia covid-p1.png
0	24	1	coughing coronavirus	1	results	https://www.webmd.com/lung/covid-19-symptoms		Symptoms of Coronavirus: Early Signs, Serious Symptoms ...www.webmd.com › ... › Coronavirus › Reference	www.webmd.com	www.webmd.com › ... › Coronavirus › Reference	Jump to What Kind of Cough Is Common? - Early studies have found that at least 60% of people with COVID-19 have a dry cough. About a third have a cough with mucus, called a “wet” or “productive” cough.		/tmp/screenshots/2020-09-17/google_coughing coronavirus-p1.png
0	24	1	coughing coronavirus	2	results	https://health.mountsinai.org/blog/i-think-i-have-covid-19-how-can-i-take-care-of-myself-at-home/#:~:text=The%20best%20approach%20to%20a,go%20to%20the%20hospital.		Riding Out COVID-19 at Home | Mount Sinai Todayhealth.mountsinai.org › blog › i-think-i-have-covid-19-h...	health.mountsinai.org	health.mountsinai.org › blog › i-think-i-have-covid-19-h...			/tmp/screenshots/2020-09-17/google_coughing coronavirus-p1.png
0	24	1	coughing coronavirus	4	results	https://www.who.int/maldives/news/detail/31-01-2020-updates-on-novel-corona-virus-(COVID-19)#:~:text=The%20virus%20can%20cause%20a,and%20deaths%20can%20occur.		Updates on Novel Corona Virus (COVID-19)www.who.int › maldives › news › detail › 31-01-2020-up...	www.who.int	www.who.int › maldives › news › detail › 31-01-2020-up...			/tmp/screenshots/2020-09-17/google_coughing coronavirus-p1.png
0	24	1	coughing coronavirus	5	results	https://www.who.int/docs/default-source/nepal-documents/novel-coronavirus/un-rumour-tracking-english-issue-2.pdf?sfvrsn=bd68b830_2#:~:text=There%20is%20no%20evidence%20that,and%20to%20prevent%20dehydration.		ISSUE#2www.who.int › docs › un-rumour-tracking-english-issue-2	www.who.int	www.who.int › docs › un-rumour-tracking-english-issue-2			/tmp/screenshots/2020-09-17/google_coughing coronavirus-p1.png
0	24	1	coughing coronavirus	6	results	https://www.cdc.gov/coronavirus/2019-ncov/faq.html#:~:text=If%20someone%20is%20showing%20any,Bluish%20lips%20or%20face.		Coronavirus (COVID-19) frequently asked questionswww.cdc.gov › coronavirus › 2019-ncov › faq	www.cdc.gov	www.cdc.gov › coronavirus › 2019-ncov › faq			/tmp/screenshots/2020-09-17/google_coughing coronavirus-p1.png
0	24	1	coughing coronavirus	7	results	https://www.sciencealert.com/not-all-coughs-mean-coronavirus-here-s-what-you-should-be-on-the-lookout-for		Here's How to Tell if Your Cough Is a Sign of Coronavirus or ...www.sciencealert.com › not-all-coughs-mean-coronavir...	www.sciencealert.com	www.sciencealert.com › not-all-coughs-mean-coronavir...	Apr 17, 2020 - COVID-19 cough: dry, persistent and leaves you short of breath. The most prominent symptoms of COVID-19 are fever and fatigue, and you may ...		/tmp/screenshots/2020-09-17/google_coughing coronavirus-p1.png
0	24	1	coughing coronavirus	8	results	https://www.umms.org/coronavirus/what-to-know/treat-covid-at-home		Treating Coronavirus at Home | University of Maryland ...www.umms.org › what-to-know › treat-covid-at-home	www.umms.org	www.umms.org › what-to-know › treat-covid-at-home	Eat a frozen treat. The coldness may help numb the pain and soothe your throat if it is sore from coughing. Suck on cough drops, lozenges or hard candy. These ...		/tmp/screenshots/2020-09-17/google_coughing coronavirus-p1.png
